paperId,title,abstract,year,citationCount,publicationDate,keywords,jcwName,authorId,authorName,correspondingAuthorId,citedPaperId,edition,reviewers
8b229216a36507730f9911433effab08c700195a,ASGN: An Active Semi-supervised Graph Neural Network for Molecular Property Prediction,molecular property prediction eg energy is an essential problem in chemistry and biology unfortunately many supervised learning methods usually suffer from the problem of scarce labeled molecules in the chemical space where such property labels are generally obtained by density functional theory dft calculation which is extremely computational costly an effective solution is to incorporate the unlabeled molecules in a semisupervised fashion however learning semisupervised representation for large amounts of molecules is challenging including the joint representation issue of both molecular essence and structure the conflict between representation and property leaning here we propose a novel framework called active semisupervised graph neural network asgn by incorporating both labeled and unlabeled molecules specifically asgn adopts a teacherstudent framework in the teacher model we propose a novel semisupervised learning method to learn general representation that jointly exploits information from molecular structure and molecular distribution then in the student model we target at property prediction task to deal with the learning loss conflict at last we proposed a novel active learning strategy in terms of molecular diversities to select informative data during the whole framework learning we conduct extensive experiments on several public datasets experimental results show the remarkable performance of our asgn framework,2020,96,2020-07-06,"Property Graph, Graph Analytics, Graph Embeddings, Graph Algorithms, Labeled Molecules, Density Functional Theory Dft Calculation, Semisupervised Representation, Large Amounts, Active Semisupervised Graph Neural Network, General Representation, Molecular Structure, Molecular Distribution, Property Prediction Task, Molecular Diversities, Informative Data, Extensive Experiments",Knowledge Discovery and Data Mining,"2068657088,46655401,1901688087,2359832,3374015,50384136,2227868312,2115294456","Zhong Hao,Chengqiang Lu,Zheyuan Hu,Hongya Wang,Zhenya Huang,Qi Liu,Enhong Chen,Cheekong Lee",2068657088,"09430c7080172d50a591cef44d85fd16e58d945e,adf914b04914a9b856e26c575c789ba19f9f118d,c7e10109fed73e523bf2a78b00e4b657004d41fc,1597449a7f64b6bd24639b4deab96c8a8c184177,5bc511aa30f72720260d792e57537379fb04c395,b080d072cfde697180db3234da08903c092e72c3,9810bcaf5ac1792e6a2738a86f85ce270d448040,6998e4ae3f1e037128bc57a56dd5d7707098e6bf,d154d986c3a402c207c6c0e22093f2e1a878fe71,e8b7a9be9f2d0578a95319ed5841978e10429967,b1706b4463701169d339c9c791cae0d4ec367b50,a60a4e5f7f872b9825ddff5d379857c2091ca52b,75c364909914f17791837ec88090262aa6656d3e,18d87bff073687c025f9bd23ab2dfb20d5f72a66,3789eb72c32ecf5e33442570358dd786dd67c8a2,db9967871249ffd77adc0c0cc16154ccc37d09ad,b473e91cbe80c8b46451b49153cd5f93030480ab,cf4068a73d72ced9809a5e2462bb450bbbd47a64,8894d431a768a35dc7ca4d762ebdba4f407b978c,fa9645e0491164fe78890073548284604958f383,8e6d0ed32aaa5e3d7c598d5a2ace76eab8485801,3a74bed911ccf213d9595b2b02a5b1c4ac4dcaf8,0a537eaf4444f0bd59f62a550430edab9d0a820d,243d553f1fc5b7ee8cfb6f49629f3a0a32b2c5c5,d63b884d5ebc739f6e1bdf861fa9276260781404,1bc34cb22131554ba18f6ba9e6ede5beb42939f1,2660dcf5bd16d14862a7bbb241fa4d85ae34327f,0608fc7e1825c4ac1f61aaa95b67f155d93b0ea4,82870bc488b57cdf5ea62877109a7278af2926b3,689c7a86d973895a14feb984b8faa3d5581038ef,44842bba66366522de782f537d9bc61d8868bf08,4e6bba65f7636a655c778a3e54cc58e148468963,7a62457a9942e45429d4b5d9d8370210df3875ec,1e4709c0b8fe3bf759cd64dc1ede695d6e5316f0,a5400a6f415d65aac1312edd2ca6b7361c241f85,752604994a7ca548ff2954114fc61a501d857b1c,91d6e8ba5dd90b02fe3bd870b19da13a6167af53,9c96a700a7abff857df936783f9e12a1ab38eee5,1d174f0e3c391368d0f3384a144a6c7487f2a143,9acd1892e2e299a30fa99f82bf60fc12cfa7aad3,da95d02a50b8208a17127987dde3cdf8da455114,e7c8fcbc24c73a576339e5f34f9f23f5ea732b3b,0534fc2dd13c781f02df2931d651fd39d03b8355,39af4070dca3221d275898c55884167bc03fe73d,933baeec555352784848a93284c9dd0e79477759,a8370aaa0ba9d69b7e83d5785c27b11be973cd84,d71c0365685300539109e0fd07e34c9dd9beff75,6fa2d1873bc12d1a698ec8d0e5e32e4236f3bd2b,ccca203382e5dd198c089a0f1d7af7bef0f694e9,bf5a42b53d156c0811e88e60d2a49f9fd9367cae,94deb62af3054c49e7d80bd7eb3ed5efe990fc0b,7ad94b0ec31d38b7915e88f743b573edb8efce5b,8640a08cdb759d52da026f6d89521e36c61b5910,456c011594ecacdd24298a161787389ccbe4b88b,dba7c73503c4b7abad96aaa4a167fd7e701c4059,16575f23ff879e6353a55bbfbbcc54e27606bfc5,4d044f0c84be360b26398b58027e618d5f08a83f,ba9b6f805feb62c978d384211f910790643a023e,046eb47d56beb8069b0098e3d01608f81ebb6849,2d95c27d4ed8cfb8379164888cd79c6b239250b4,a4c5339f3f31c4a4406a1d82d3b0f3c63386166e,aca6d5f3866372a4506cf15773ae298f18c3f453,bf69c98fca9a9f6c1cde871beddbcdc668b77771,32c1e0f9ef6f1e337fe4aa2a4907314e5a3f4a5b,6aca07154c111f1c8738347d7112cad6b0bf974a,be88a24e9b6e26f10d4d84183c8f05ba33eb60c0,07c4549be429a52274bc0ec083bf5598a3e5c365,ed9e7821b3e51c7e59183300d6c8cf90c8de0f26,bc6dbcaf4d2c76e618ae3f1043fd7276cbdf7f9b,b8aecf918f1c729eb2a2fa88da9eb16835daca5a,59f1df2f60280eea79d195b9c561d52a77fb24de,bfdc1a7d5aab0f4bce4afc9723192937c24ef5ff,610063bfb7cb1e634f784ebe0799d0cb45f5480c,1f9058eb0b639d0dffae192b3ffd5d80adabf0e9,718b5a40dba91bfa0bdfb9ac9ca4381425d2ff95,d9f836a2062864e4808e12224e2286a353498202,e3d74f13374063a86909c7b0a8105be94902b7f4,70f7cd54b5918aed60c3d8c3a8e4aa7e8d634c41,59a268ee97ba83c04abbe02769bd61dcd3747d25,0ff76855604fc150ecd36bc8c3197780a8ea2b23,d65d64c3f6ea322d9e85138fe5c8e85acbf661e3,17fca92ffd527c78c5dc6c7953e96671743807fa,80dd97954ddf3edd22d4cb21f0ac31b7ffed6bbf,91fc647899f801c9d351349ce73779918f90a713,5d8b271c412f4be0c689bdfde93916efa0951deb,1c2de5fc71be2be3af28545e873605ead4d7d79b,4e13a8e8ba8d33e15ed037bfca7c651047533990,391a5f286f814d852dddcab1b2b68e5c1af6c79e,7c70459d56214a7a3202732670f5ce726508eff6,b34fc78de28be598e21118d7cb9d84d63374addc,63dc64fc2d23be98100f4c59e82278d838c78ef9,b6b7fea1846e85ac1e3c7e3adda6e65b127d0368,873b045dea18c2092b2c11e7b9542dd93ce84d65,dbabab9bf5955558f73a37644f4bb626106a6d73,1fe201d9ec4d072c7af233d265927388f32d3ab3,3527f43e8156d1bf5a0998405047c98036d172f0",20,"1410652795.0,3615640.0,2070105034.0"
610063bfb7cb1e634f784ebe0799d0cb45f5480c,A Property Testing Framework for the Theoretical Expressivity of Graph Kernels,graph kernels are applied heavily for the classification of structured data however their expressivity is assessed almost exclusively from experimental studies and there is no theoretical justification why one kernel is in general preferable over another we introduce a theoretical framework for investigating the expressive power of graph kernels which is inspired by concepts from the area of property testing we introduce the notion of distinguishability of a graph property by a graph kernel for several established graph kernels we show that they cannot distinguish essential graph properties in order to overcome this we consider a kernel based on kdisc frequencies we show that this efficiently computable kernel can distinguish fundamental graph properties finally we obtain learning guarantees for nearest neighbor classifiers in our framework,2018,30,2018-07-01,"Property Graph, Graph Analytics, Graph Embeddings, Graph Neural Networks, Graph Kernels, Structured Data, Experimental Studies, Property Testing, Essential Graph Properties, Kdisc Frequencies, Fundamental Graph Properties, Nearest Neighbor Classifiers",International Joint Conference on Artificial Intelligence,"1810077,143622465,39352108,1701715","Nils M. Kriege,Christopher Morris,Anja Rey,C. Sohler",1810077,"07627bf7eb649220ffbcdf6bf233e3a4a76e8590,42fe18be6e9ff2c11e5b2347c93e131c9abc7a51,be88a24e9b6e26f10d4d84183c8f05ba33eb60c0,b31ce19f12bbf6058f4fe849d9f3654932353f20,7ad94b0ec31d38b7915e88f743b573edb8efce5b,0fbe5e2f2e2b8e2b2e2f0013e2e07cac2e5ce926,3b217403302f9cb9d9685404c7646de7bc0db428,07c4549be429a52274bc0ec083bf5598a3e5c365,a8370aaa0ba9d69b7e83d5785c27b11be973cd84,933baeec555352784848a93284c9dd0e79477759,da619a6c524f5ab800b44c8728db3cef3d3b25d9,1597449a7f64b6bd24639b4deab96c8a8c184177,6998e4ae3f1e037128bc57a56dd5d7707098e6bf,16575f23ff879e6353a55bbfbbcc54e27606bfc5,f47def30face829e8034a292c2e3e7a9f4240d34,7c70459d56214a7a3202732670f5ce726508eff6,fa9645e0491164fe78890073548284604958f383,752604994a7ca548ff2954114fc61a501d857b1c,1c2de5fc71be2be3af28545e873605ead4d7d79b,b473e91cbe80c8b46451b49153cd5f93030480ab,2660dcf5bd16d14862a7bbb241fa4d85ae34327f,1f9058eb0b639d0dffae192b3ffd5d80adabf0e9,32c1e0f9ef6f1e337fe4aa2a4907314e5a3f4a5b,ce8a567f7578e8b6c9dc6510e2b058bd3a02019c,02a88547d6f6022bebc9aba6723a310cdf132f3f,4d1fdd81f033cd58f3723bfc61e7d12079647a7a,94deb62af3054c49e7d80bd7eb3ed5efe990fc0b,c48e0bd0f36c25ab83befbc7b7da369b75fd25f5,bf5a42b53d156c0811e88e60d2a49f9fd9367cae,5ccd1eefd94af0a20e10a0a5e0da22aa2f481c76",18,"2237403667.0,2051250.0,51218701.0"
d9f836a2062864e4808e12224e2286a353498202,Graph Convolutional Policy Network for Goal-Directed Molecular Graph Generation,generating novel graph structures that optimize given objectives while obeying some given underlying rules is fundamental for chemistry biology and social science research this is especially important in the task of molecular graph generation whose goal is to discover novel molecules with desired properties such as druglikeness and synthetic accessibility while obeying physical laws such as chemical valency however designing models to find molecules that optimize desired properties while incorporating highly complex and nondifferentiable rules remains to be a challenging task here we propose graph convolutional policy network gcpn a general graph convolutional network based model for goaldirected graph generation through reinforcement learning the model is trained to optimize domainspecific rewards and adversarial loss through policy gradient and acts in an environment that incorporates domainspecific rules experimental results show that gcpn can achieve  improvement on chemical property optimization over stateoftheart baselines while resembling known molecules and achieve  improvement on the constrained property optimization task,2018,15,2018-06-07,"Property Graph, Graph Algorithms, Property Graph Schema, Graph Modeling, Underlying Rules, Chemistry Biology, Social Science Research, Molecular Graph Generation, Novel Molecules, Desired Properties, Synthetic Accessibility, Physical Laws, Chemical Valency, Graph Convolutional Policy Network, Goaldirected Graph Generation, Domainspecific Rewards, Adversarial Loss, Policy Gradient, Domainspecific Rules, Experimental Results, Chemical Property Optimization, Stateoftheart Baselines, Known Molecules",Neural Information Processing Systems,"145829303,2156641189,83539859,1806271,1702139","Jiaxuan You,Bowen Liu,Rex Ying,V. Pande,J. Leskovec",145829303,"91b63db746becca15090963a8990dfe2b5103799,bf69c98fca9a9f6c1cde871beddbcdc668b77771,1e4709c0b8fe3bf759cd64dc1ede695d6e5316f0,b31ce19f12bbf6058f4fe849d9f3654932353f20,61aec24ce3ce839bf08ce98e061099f2a20a50d6,bf5a42b53d156c0811e88e60d2a49f9fd9367cae,42fe18be6e9ff2c11e5b2347c93e131c9abc7a51,7ad94b0ec31d38b7915e88f743b573edb8efce5b,82181d5c33590a81ab3b773c3948141eb22d89fb,1c2de5fc71be2be3af28545e873605ead4d7d79b,1597449a7f64b6bd24639b4deab96c8a8c184177,16575f23ff879e6353a55bbfbbcc54e27606bfc5,cf4068a73d72ced9809a5e2462bb450bbbd47a64,be88a24e9b6e26f10d4d84183c8f05ba33eb60c0,adf914b04914a9b856e26c575c789ba19f9f118d",18,"143833453.0,39352108.0,1780833.0"
3323a47e69832301f8f434119b0346fc69708915,GraphDF: A Discrete Flow Model for Molecular Graph Generation,we consider the problem of molecular graph generation using deep models while graphs are discrete most existing methods use continuous latent variables resulting in inaccurate modeling of discrete graph structures in this work we propose graphdf a novel discrete latent variable model for molecular graph generation based on normalizing flow methods graphdf uses invertible modulo shift transforms to map discrete latent variables to graph nodes and edges we show that the use of discrete latent variables reduces computational costs and eliminates the negative effect of dequantization comprehensive experimental results show that graphdf outperforms prior methods on random generation property optimization and constrained optimization tasks,2021,116,2021-02-02,"Property Graph, Graph Analytics, Graph Representation Learning, Graph Partitioning, Molecular Graph Generation, Deep Models, Continuous Latent Variables, Inaccurate Modeling, Discrete Graph Structures, Normalizing Flow Methods, Invertible Modulo Shift, Discrete Latent Variables, Graph Nodes, Computational Costs, Dequantization Comprehensive Experimental Results, Prior Methods, Random Generation Property Optimization, Constrained Optimization Tasks",International Conference on Machine Learning,"2004524780,1879114760,1743600","Youzhi Luo,Keqiang Yan,Shuiwang Ji",2004524780,"9810bcaf5ac1792e6a2738a86f85ce270d448040,16575f23ff879e6353a55bbfbbcc54e27606bfc5,da619a6c524f5ab800b44c8728db3cef3d3b25d9,b1706b4463701169d339c9c791cae0d4ec367b50,1f9058eb0b639d0dffae192b3ffd5d80adabf0e9,b473e91cbe80c8b46451b49153cd5f93030480ab,91b63db746becca15090963a8990dfe2b5103799,30acd43e62dbbdbe823bcc321ca1a1660ec7a622,0026ea8a0fd31bdc959a4b9ed4d449f3015be8d1,94deb62af3054c49e7d80bd7eb3ed5efe990fc0b,bfdc1a7d5aab0f4bce4afc9723192937c24ef5ff,c48e0bd0f36c25ab83befbc7b7da369b75fd25f5,6eb5744bd933dcd29ff4d79e340cf890272ef099,be88a24e9b6e26f10d4d84183c8f05ba33eb60c0,aca6d5f3866372a4506cf15773ae298f18c3f453,d9f836a2062864e4808e12224e2286a353498202,b080d072cfde697180db3234da08903c092e72c3,fa9645e0491164fe78890073548284604958f383,4d044f0c84be360b26398b58027e618d5f08a83f,1e4709c0b8fe3bf759cd64dc1ede695d6e5316f0,bc9fde639ceaceafe84c0ad94a2cd7badef141d3,689c7a86d973895a14feb984b8faa3d5581038ef,a4c5339f3f31c4a4406a1d82d3b0f3c63386166e,bc6dbcaf4d2c76e618ae3f1043fd7276cbdf7f9b,a8370aaa0ba9d69b7e83d5785c27b11be973cd84,1597449a7f64b6bd24639b4deab96c8a8c184177,f47def30face829e8034a292c2e3e7a9f4240d34,56092013ab20394725719910fc7d4fe2274f3d54,d154d986c3a402c207c6c0e22093f2e1a878fe71,dba7c73503c4b7abad96aaa4a167fd7e701c4059,3789eb72c32ecf5e33442570358dd786dd67c8a2,456c011594ecacdd24298a161787389ccbe4b88b,659d8b24e53e8adfbcb1f16b26ada2cb8afa2c85,7ad94b0ec31d38b7915e88f743b573edb8efce5b,243d553f1fc5b7ee8cfb6f49629f3a0a32b2c5c5,91d6e8ba5dd90b02fe3bd870b19da13a6167af53,59f1df2f60280eea79d195b9c561d52a77fb24de,ecef432e7f6c9f431d5b34706a8de1fdebec46f9,d8b65198c37ada92cada81fe315508fc5bdbab8f,0608fc7e1825c4ac1f61aaa95b67f155d93b0ea4,80dd97954ddf3edd22d4cb21f0ac31b7ffed6bbf,70f7cd54b5918aed60c3d8c3a8e4aa7e8d634c41,e8b7a9be9f2d0578a95319ed5841978e10429967,e3d74f13374063a86909c7b0a8105be94902b7f4,adf914b04914a9b856e26c575c789ba19f9f118d,ce8a567f7578e8b6c9dc6510e2b058bd3a02019c,122a535ae02d4e0fa2512f9c3be77eae6a007266,91fc647899f801c9d351349ce73779918f90a713,09430c7080172d50a591cef44d85fd16e58d945e,ba9b6f805feb62c978d384211f910790643a023e,6570ee5bd1656fddbdb030410a9d996739586067,02a88547d6f6022bebc9aba6723a310cdf132f3f,82181d5c33590a81ab3b773c3948141eb22d89fb,b6b7fea1846e85ac1e3c7e3adda6e65b127d0368,3dfa820702b6181c9964931f0a4d47fd298bf429,1f8a23697562b001082b147779b5eaefd3513d0a,7b663c42dd72e2585eed4bf7fc41739e07ce9ff3,d71c0365685300539109e0fd07e34c9dd9beff75,dbabab9bf5955558f73a37644f4bb626106a6d73,61aec24ce3ce839bf08ce98e061099f2a20a50d6,db9967871249ffd77adc0c0cc16154ccc37d09ad,247dec05283a1a521f99253a6cca6a5858cac0d2,391a5f286f814d852dddcab1b2b68e5c1af6c79e,0ff76855604fc150ecd36bc8c3197780a8ea2b23,18d87bff073687c025f9bd23ab2dfb20d5f72a66,3527f43e8156d1bf5a0998405047c98036d172f0,30bf7d1694641f6bb3289d980a2326183ad560f0,a5400a6f415d65aac1312edd2ca6b7361c241f85,3b217403302f9cb9d9685404c7646de7bc0db428,17fca92ffd527c78c5dc6c7953e96671743807fa,57dcff5c3c15f6c5e5935ef7164c8f467a53848b,6998e4ae3f1e037128bc57a56dd5d7707098e6bf,3a74bed911ccf213d9595b2b02a5b1c4ac4dcaf8,6fa2d1873bc12d1a698ec8d0e5e32e4236f3bd2b,0ebd0ad7fbedde936390eeac6aed1356876cbeff,b31ce19f12bbf6058f4fe849d9f3654932353f20,0534fc2dd13c781f02df2931d651fd39d03b8355,44842bba66366522de782f537d9bc61d8868bf08,1c2de5fc71be2be3af28545e873605ead4d7d79b,0fbe5e2f2e2b8e2b2e2f0013e2e07cac2e5ce926,5ccd1eefd94af0a20e10a0a5e0da22aa2f481c76,1d174f0e3c391368d0f3384a144a6c7487f2a143,8640a08cdb759d52da026f6d89521e36c61b5910,28816b148281af9ba41469b4c69dd69c2afd2b95,9acd1892e2e299a30fa99f82bf60fc12cfa7aad3,4d1fdd81f033cd58f3723bfc61e7d12079647a7a,f117c6f12d067bd66dad40996b3931c069daa2da,8894d431a768a35dc7ca4d762ebdba4f407b978c,8e6d0ed32aaa5e3d7c598d5a2ace76eab8485801,15748c0437c3be2e464dfb6aa42d2ff5dbd5d7f7,ccca203382e5dd198c089a0f1d7af7bef0f694e9,2742192c8d7248be8423e0333a9ab1c62c98bbbd,5bc511aa30f72720260d792e57537379fb04c395,7f5cd5b1340ac06ea38bd05373c30136a6f4c1ca,0a829289a16ae48837cc2905635435db98bacc76,39af4070dca3221d275898c55884167bc03fe73d,bcad76ae5cea05bad85fd6b2b08aa30a801d9a3b,1bc34cb22131554ba18f6ba9e6ede5beb42939f1,bf5a42b53d156c0811e88e60d2a49f9fd9367cae,fe44200fed05f9a7c656f2245deded8fd5f5e1e6,0a537eaf4444f0bd59f62a550430edab9d0a820d,521e5c337be51b8f8fdb858580bb46a0545ab1f9,cc1e82125f7f8636b25ccdcdb63e8f812add7f87,07c4549be429a52274bc0ec083bf5598a3e5c365,63dc64fc2d23be98100f4c59e82278d838c78ef9,d427db1ba2cc92b36d16a5e5114f1027c90fff68,c24d47ff95cd4bda073c75ec24ececaa3b10c995,ed9e7821b3e51c7e59183300d6c8cf90c8de0f26,8dbab8de29b183d7589be8a568bca4b31902a54b,d63b884d5ebc739f6e1bdf861fa9276260781404,e3b9ffde49c9b4a57b09a651187a2e194cb35693,b15e942e526e4a03ecd0af31cbdf9b43bf81a829,a50f37cdd0614567ef52ffa63c70285d97630ce4,ca0e479ba2327f71e842d033b6b48b082962cc6a,efca2a32ce9c7a808c2c3efcc2c3dac032dfc8ea,a60a4e5f7f872b9825ddff5d379857c2091ca52b",21,"50470670.0,1694512.0,143645968.0"
07627bf7eb649220ffbcdf6bf233e3a4a76e8590,Asymmetric Transitivity Preserving Graph Embedding,graph embedding algorithms embed a graph into a vector space where the structure and the inherent properties of the graph are preserved the existing graph embedding methods cannot preserve the asymmetric transitivity well which is a critical property of directed graphs asymmetric transitivity depicts the correlation among directed edges that is if there is a directed path from u to v then there is likely a directed edge from u to v asymmetric transitivity can help in capturing structures of graphs and recovering from partially observed graphs to tackle this challenge we propose the idea of preserving asymmetric transitivity by approximating highorder proximity which are based on asymmetric transitivity in particular we develop a novel graph embedding algorithm highorder proximity preserved embedding hope for short which is scalable to preserve highorder proximities of large scale graphs and capable of capturing the asymmetric transitivity more specifically we first derive a general formulation that cover multiple popular highorder proximity measurements then propose a scalable embedding algorithm to approximate the highorder proximity measurements based on their general formulation moreover we provide a theoretical upper bound on the rmse root mean squared error of the approximation our empirical experiments on a synthetic dataset and three realworld datasets demonstrate that hope can approximate the highorder proximities significantly better than the stateofart algorithms and outperform the stateofart algorithms in tasks of reconstruction link prediction and vertex recommendation,2016,38,2016-08-13,"Property Graph, Graph Similarity, Graph Clustering, Property Graph Schema, Graph Embedding Algorithms, Directed Graphs Asymmetric Transitivity, Directed Edges, Asymmetric Transitivity, Partially Observed Graphs, Approximating Highorder Proximity, Algorithm Highorder Proximity, Embedding Hope, Highorder Proximities, Large Scale Graphs, Multiple Popular Highorder Proximity Measurements, Reconstruction Link Prediction, Vertex Recommendation",Knowledge Discovery and Data Mining,"1731068,143738684,145525190,48806258,145583986","Mingdong Ou,Peng Cui,J. Pei,Ziwei Zhang,Wenwu Zhu",1731068,"1e4709c0b8fe3bf759cd64dc1ede695d6e5316f0,093e777e08d3a5474e225bbdb1a124d30434d416,91b63db746becca15090963a8990dfe2b5103799,3b217403302f9cb9d9685404c7646de7bc0db428,02a88547d6f6022bebc9aba6723a310cdf132f3f,b8aecf918f1c729eb2a2fa88da9eb16835daca5a,1d174f0e3c391368d0f3384a144a6c7487f2a143,8cfb3412f1bd6025e14f4665c5723ed60a5d8061,ce8a567f7578e8b6c9dc6510e2b058bd3a02019c,de6cf3534f39748a223b9bb2b59d2e7ffcb6ae03,d71c0365685300539109e0fd07e34c9dd9beff75,bcad76ae5cea05bad85fd6b2b08aa30a801d9a3b,e3b9ffde49c9b4a57b09a651187a2e194cb35693,82181d5c33590a81ab3b773c3948141eb22d89fb,69381b5efd97e7c55f51c2730caccab3d632d4d2,dac7344737cb824634f757aede2dd46a6eed204b,5ccd1eefd94af0a20e10a0a5e0da22aa2f481c76,c48e0bd0f36c25ab83befbc7b7da369b75fd25f5,59a268ee97ba83c04abbe02769bd61dcd3747d25,0fbe5e2f2e2b8e2b2e2f0013e2e07cac2e5ce926,f47def30face829e8034a292c2e3e7a9f4240d34,dba7c73503c4b7abad96aaa4a167fd7e701c4059,b31ce19f12bbf6058f4fe849d9f3654932353f20,00d681cfff7f0224ace607e515f4ed510e792df9,bf69c98fca9a9f6c1cde871beddbcdc668b77771,2660dcf5bd16d14862a7bbb241fa4d85ae34327f,1bc34cb22131554ba18f6ba9e6ede5beb42939f1,4e6bba65f7636a655c778a3e54cc58e148468963,bf5a42b53d156c0811e88e60d2a49f9fd9367cae,da619a6c524f5ab800b44c8728db3cef3d3b25d9,94deb62af3054c49e7d80bd7eb3ed5efe990fc0b,db9967871249ffd77adc0c0cc16154ccc37d09ad,f117c6f12d067bd66dad40996b3931c069daa2da,07c4549be429a52274bc0ec083bf5598a3e5c365,1c2de5fc71be2be3af28545e873605ead4d7d79b,7a62457a9942e45429d4b5d9d8370210df3875ec,bc9fde639ceaceafe84c0ad94a2cd7badef141d3,7ad94b0ec31d38b7915e88f743b573edb8efce5b",16,"2288582453.0,46251839.0,145463228.0"
