paperId,title,abstract,year,citationCount,publicationDate,keywords,jcwName,authorId,authorName,correspondingAuthorId,citedPaperId,edition,reviewers
1a901533b09269bafa1222ad5f2f5eb0279915ac,Graph Information Bottleneck for Subgraph Recognition,given the input graph and its labelproperty several key problems of graph learning such as finding interpretable subgraphs graph denoising and graph compression can be attributed to the fundamental problem of recognizing a subgraph of the original one this subgraph shall be as informative as possible yet contains less redundant and noisy structure this problem setting is closely related to the wellknown information bottleneck ib principle which however has less been studied for the irregular graph data and graph neural networks gnns in this paper we propose a framework of graph information bottleneck gib for the subgraph recognition problem in deep graph learning under this framework one can recognize the maximally informative yet compressive subgraph named ibsubgraph however the gib objective is notoriously hard to optimize mostly due to the intractability of the mutual information of irregular graph data and the unstable optimization process in order to tackle these challenges we propose i a gib objective basedon a mutual information estimator for the irregular graph data ii a bilevel optimization scheme to maximize the gib objective iii a connectivity loss to stabilize the optimization process we evaluate the properties of the ibsubgraph in three application scenarios improvement of graph classification graph interpretation and graph denoising extensive experiments demonstrate that the informationtheoretic ibsubgraph enjoys superior graph properties,2020,90,2020-10-12,"Property Graph, Graph Pattern Matching, Graph Database, Property Graph Query Languages, Interpretable Subgraphs, Graph Compression, Graph Neural Networks Gnns, Graph Information Bottleneck Gib, Deep Graph, Irregular Graph Data, Graph Classification Graph Interpretation, Extensive Experiments, Superior Graph Properties",International Conference on Learning Representations,"28822585,1754673,48537464,2419616,1768190,143712929","Junchi Yu,Tingyang Xu,Yu Rong,Yatao Bian,Junzhou Huang,R. He",28822585,"78e40584f0d149bf6f98beb5561b7b83cb68e1b1,91fc647899f801c9d351349ce73779918f90a713,3dfa820702b6181c9964931f0a4d47fd298bf429,7a62457a9942e45429d4b5d9d8370210df3875ec,6351590cf37eef826b89383fd8ccf8f1ab276559,1e4709c0b8fe3bf759cd64dc1ede695d6e5316f0,2d95c27d4ed8cfb8379164888cd79c6b239250b4,a8370aaa0ba9d69b7e83d5785c27b11be973cd84,cf4068a73d72ced9809a5e2462bb450bbbd47a64,59a268ee97ba83c04abbe02769bd61dcd3747d25,18d87bff073687c025f9bd23ab2dfb20d5f72a66,dbabab9bf5955558f73a37644f4bb626106a6d73,48fc9c42522184c652742255fdf31f7b9ed7ebae,a0d18dddaa995b126ad373e33767b9b881d16b2f,bc6dbcaf4d2c76e618ae3f1043fd7276cbdf7f9b,b080d072cfde697180db3234da08903c092e72c3,521e5c337be51b8f8fdb858580bb46a0545ab1f9,e8b7a9be9f2d0578a95319ed5841978e10429967,659d8b24e53e8adfbcb1f16b26ada2cb8afa2c85,247dec05283a1a521f99253a6cca6a5858cac0d2,933baeec555352784848a93284c9dd0e79477759,da95d02a50b8208a17127987dde3cdf8da455114,d65d64c3f6ea322d9e85138fe5c8e85acbf661e3,122a535ae02d4e0fa2512f9c3be77eae6a007266,59f1df2f60280eea79d195b9c561d52a77fb24de,243d553f1fc5b7ee8cfb6f49629f3a0a32b2c5c5,3a74bed911ccf213d9595b2b02a5b1c4ac4dcaf8,0ff76855604fc150ecd36bc8c3197780a8ea2b23,d8b65198c37ada92cada81fe315508fc5bdbab8f,30bf7d1694641f6bb3289d980a2326183ad560f0,6998e4ae3f1e037128bc57a56dd5d7707098e6bf,c48e0bd0f36c25ab83befbc7b7da369b75fd25f5,6fa2d1873bc12d1a698ec8d0e5e32e4236f3bd2b,de6cf3534f39748a223b9bb2b59d2e7ffcb6ae03,6289d1271ff8176888d971bd8468dc5495b533f0,b15e942e526e4a03ecd0af31cbdf9b43bf81a829,0608fc7e1825c4ac1f61aaa95b67f155d93b0ea4,dba7c73503c4b7abad96aaa4a167fd7e701c4059,63dc64fc2d23be98100f4c59e82278d838c78ef9,02a88547d6f6022bebc9aba6723a310cdf132f3f,456c011594ecacdd24298a161787389ccbe4b88b,b8aecf918f1c729eb2a2fa88da9eb16835daca5a,0fbe5e2f2e2b8e2b2e2f0013e2e07cac2e5ce926,dac7344737cb824634f757aede2dd46a6eed204b,94deb62af3054c49e7d80bd7eb3ed5efe990fc0b,b31ce19f12bbf6058f4fe849d9f3654932353f20,17fca92ffd527c78c5dc6c7953e96671743807fa,32c1e0f9ef6f1e337fe4aa2a4907314e5a3f4a5b,1c2de5fc71be2be3af28545e873605ead4d7d79b,718b5a40dba91bfa0bdfb9ac9ca4381425d2ff95,bcad76ae5cea05bad85fd6b2b08aa30a801d9a3b,16575f23ff879e6353a55bbfbbcc54e27606bfc5,82870bc488b57cdf5ea62877109a7278af2926b3,1f9058eb0b639d0dffae192b3ffd5d80adabf0e9,75fb60dee6641656fc4c1b663bb95d1aa91c6798,ed9e7821b3e51c7e59183300d6c8cf90c8de0f26,7b663c42dd72e2585eed4bf7fc41739e07ce9ff3,0a537eaf4444f0bd59f62a550430edab9d0a820d,b1706b4463701169d339c9c791cae0d4ec367b50,ccca203382e5dd198c089a0f1d7af7bef0f694e9,47bca586abefde3b796b65c986269f082fcb59c5,4e6bba65f7636a655c778a3e54cc58e148468963,08257eb1faa19c29ddcc31d7d749c9bd262213c5,2742192c8d7248be8423e0333a9ab1c62c98bbbd,b50187eff988dea028d4c4e7ecdfa00ef4ac893d,b473e91cbe80c8b46451b49153cd5f93030480ab,d63b884d5ebc739f6e1bdf861fa9276260781404,75c364909914f17791837ec88090262aa6656d3e,873b045dea18c2092b2c11e7b9542dd93ce84d65,28816b148281af9ba41469b4c69dd69c2afd2b95,bc9fde639ceaceafe84c0ad94a2cd7badef141d3,09430c7080172d50a591cef44d85fd16e58d945e,046eb47d56beb8069b0098e3d01608f81ebb6849,bfdc1a7d5aab0f4bce4afc9723192937c24ef5ff,65499384f0947e223ec83f582366203e7aa64f1f,80dd97954ddf3edd22d4cb21f0ac31b7ffed6bbf,82181d5c33590a81ab3b773c3948141eb22d89fb,1f8a23697562b001082b147779b5eaefd3513d0a,ba9b6f805feb62c978d384211f910790643a023e,fe44200fed05f9a7c656f2245deded8fd5f5e1e6,7ad94b0ec31d38b7915e88f743b573edb8efce5b,ca5931b4c08eb96d40c65e1b9f8e4db46bf0585b,e7c8fcbc24c73a576339e5f34f9f23f5ea732b3b,391a5f286f814d852dddcab1b2b68e5c1af6c79e,00d681cfff7f0224ace607e515f4ed510e792df9,6eb5744bd933dcd29ff4d79e340cf890272ef099,42fe18be6e9ff2c11e5b2347c93e131c9abc7a51,69381b5efd97e7c55f51c2730caccab3d632d4d2,b34fc78de28be598e21118d7cb9d84d63374addc,be88a24e9b6e26f10d4d84183c8f05ba33eb60c0",20,"40379784,145153297,13027820"
15748c0437c3be2e464dfb6aa42d2ff5dbd5d7f7,Understanding the Representation Power of Graph Neural Networks in Learning Graph Topology,to deepen our understanding of graph neural networks we investigate the representation power of graph convolutional networks gcn through the looking glass of graph moments a key property of graph topology encoding path of various lengths we find that gcns are rather restrictive in learning graph moments without careful design gcns can fail miserably even with multiple layers and nonlinear activation functions we analyze theoretically the expressiveness of gcns arriving at a modular gcn design using different propagation rules our modular design is capable of distinguishing graphs from different graph generation models for surprisingly small graphs a notoriously difficult problem in network science our investigation suggests that depth is much more influential than width with deeper gcns being more capable of learning higher order graph moments additionally combining gcn modules with different propagation rules is critical to the representation power of gcns,2019,110,2019-07-11,"Property Graph, Property Graph Schema, Graph Mining, Graph Algorithms, Graph Neural Networks, Graph Convolutional Networks, Graph Topology Encoding Path, Graph Moments, Careful Design Gcns, Different Graph Generation Models, Surprisingly Small Graphs, Network Science, Deeper Gcns, Higher Order Graph Moments, Gcn Modules, Different Propagation Rules",Neural Information Processing Systems,"9716460,1745069,2023052","Nima Dehmamy,A. Barabási,Rose Yu",9716460,"07627bf7eb649220ffbcdf6bf233e3a4a76e8590,efca2a32ce9c7a808c2c3efcc2c3dac032dfc8ea,3a74bed911ccf213d9595b2b02a5b1c4ac4dcaf8,6998e4ae3f1e037128bc57a56dd5d7707098e6bf,75fb60dee6641656fc4c1b663bb95d1aa91c6798,b1706b4463701169d339c9c791cae0d4ec367b50,6eb5744bd933dcd29ff4d79e340cf890272ef099,4d044f0c84be360b26398b58027e618d5f08a83f,e7c8fcbc24c73a576339e5f34f9f23f5ea732b3b,501b6c76007e700e1b82f34930d24fc04709fc9d,da95d02a50b8208a17127987dde3cdf8da455114,adf914b04914a9b856e26c575c789ba19f9f118d,bcad76ae5cea05bad85fd6b2b08aa30a801d9a3b,17fca92ffd527c78c5dc6c7953e96671743807fa,42fe18be6e9ff2c11e5b2347c93e131c9abc7a51,16575f23ff879e6353a55bbfbbcc54e27606bfc5,02a88547d6f6022bebc9aba6723a310cdf132f3f,d9f836a2062864e4808e12224e2286a353498202,d63b884d5ebc739f6e1bdf861fa9276260781404,d427db1ba2cc92b36d16a5e5114f1027c90fff68,1d174f0e3c391368d0f3384a144a6c7487f2a143,d8b65198c37ada92cada81fe315508fc5bdbab8f,1e4709c0b8fe3bf759cd64dc1ede695d6e5316f0,b31ce19f12bbf6058f4fe849d9f3654932353f20,59a268ee97ba83c04abbe02769bd61dcd3747d25,da619a6c524f5ab800b44c8728db3cef3d3b25d9,6aca07154c111f1c8738347d7112cad6b0bf974a,d65d64c3f6ea322d9e85138fe5c8e85acbf661e3,247dec05283a1a521f99253a6cca6a5858cac0d2,ecef432e7f6c9f431d5b34706a8de1fdebec46f9,cf4068a73d72ced9809a5e2462bb450bbbd47a64,3527f43e8156d1bf5a0998405047c98036d172f0,093e777e08d3a5474e225bbdb1a124d30434d416,2742192c8d7248be8423e0333a9ab1c62c98bbbd,de6cf3534f39748a223b9bb2b59d2e7ffcb6ae03,8cfb3412f1bd6025e14f4665c5723ed60a5d8061,7c70459d56214a7a3202732670f5ce726508eff6,5bc511aa30f72720260d792e57537379fb04c395,91d6e8ba5dd90b02fe3bd870b19da13a6167af53,1c2de5fc71be2be3af28545e873605ead4d7d79b,db9967871249ffd77adc0c0cc16154ccc37d09ad,59f1df2f60280eea79d195b9c561d52a77fb24de,28816b148281af9ba41469b4c69dd69c2afd2b95,4d1fdd81f033cd58f3723bfc61e7d12079647a7a,0ff76855604fc150ecd36bc8c3197780a8ea2b23,1f9058eb0b639d0dffae192b3ffd5d80adabf0e9,391a5f286f814d852dddcab1b2b68e5c1af6c79e,7ad94b0ec31d38b7915e88f743b573edb8efce5b,44842bba66366522de782f537d9bc61d8868bf08,0a537eaf4444f0bd59f62a550430edab9d0a820d,9e3816be8cf4821d74e258de10ee471382936a30,1bc34cb22131554ba18f6ba9e6ede5beb42939f1,6fa2d1873bc12d1a698ec8d0e5e32e4236f3bd2b,a5400a6f415d65aac1312edd2ca6b7361c241f85,752604994a7ca548ff2954114fc61a501d857b1c,dac7344737cb824634f757aede2dd46a6eed204b,b473e91cbe80c8b46451b49153cd5f93030480ab,4e6bba65f7636a655c778a3e54cc58e148468963,243d553f1fc5b7ee8cfb6f49629f3a0a32b2c5c5,b15e942e526e4a03ecd0af31cbdf9b43bf81a829,7a62457a9942e45429d4b5d9d8370210df3875ec,c48e0bd0f36c25ab83befbc7b7da369b75fd25f5,9acd1892e2e299a30fa99f82bf60fc12cfa7aad3,5d8b271c412f4be0c689bdfde93916efa0951deb,91fc647899f801c9d351349ce73779918f90a713,8640a08cdb759d52da026f6d89521e36c61b5910,4e13a8e8ba8d33e15ed037bfca7c651047533990,39af4070dca3221d275898c55884167bc03fe73d,61aec24ce3ce839bf08ce98e061099f2a20a50d6,3bc9bb1f2218dcbd15c3b7cdfcb43077a3f30779,d154d986c3a402c207c6c0e22093f2e1a878fe71,fa9645e0491164fe78890073548284604958f383,0534fc2dd13c781f02df2931d651fd39d03b8355,bf5a42b53d156c0811e88e60d2a49f9fd9367cae,65499384f0947e223ec83f582366203e7aa64f1f,f117c6f12d067bd66dad40996b3931c069daa2da,b8aecf918f1c729eb2a2fa88da9eb16835daca5a,ce8a567f7578e8b6c9dc6510e2b058bd3a02019c,8f7a7aea33c942e626832f014a831361b7fa39c7,5ccd1eefd94af0a20e10a0a5e0da22aa2f481c76,dba7c73503c4b7abad96aaa4a167fd7e701c4059,8e6d0ed32aaa5e3d7c598d5a2ace76eab8485801,2660dcf5bd16d14862a7bbb241fa4d85ae34327f,82181d5c33590a81ab3b773c3948141eb22d89fb,3b217403302f9cb9d9685404c7646de7bc0db428,00d681cfff7f0224ace607e515f4ed510e792df9,32c1e0f9ef6f1e337fe4aa2a4907314e5a3f4a5b,69381b5efd97e7c55f51c2730caccab3d632d4d2,521e5c337be51b8f8fdb858580bb46a0545ab1f9,0a829289a16ae48837cc2905635435db98bacc76,f47def30face829e8034a292c2e3e7a9f4240d34,30bf7d1694641f6bb3289d980a2326183ad560f0,e3d74f13374063a86909c7b0a8105be94902b7f4,07c4549be429a52274bc0ec083bf5598a3e5c365,94deb62af3054c49e7d80bd7eb3ed5efe990fc0b,91b63db746becca15090963a8990dfe2b5103799,70f7cd54b5918aed60c3d8c3a8e4aa7e8d634c41,bf69c98fca9a9f6c1cde871beddbcdc668b77771,610063bfb7cb1e634f784ebe0799d0cb45f5480c,122a535ae02d4e0fa2512f9c3be77eae6a007266,0fbe5e2f2e2b8e2b2e2f0013e2e07cac2e5ce926,8dbab8de29b183d7589be8a568bca4b31902a54b,d71c0365685300539109e0fd07e34c9dd9beff75,1597449a7f64b6bd24639b4deab96c8a8c184177,dbabab9bf5955558f73a37644f4bb626106a6d73,bc9fde639ceaceafe84c0ad94a2cd7badef141d3,a8370aaa0ba9d69b7e83d5785c27b11be973cd84,bfdc1a7d5aab0f4bce4afc9723192937c24ef5ff,bc6dbcaf4d2c76e618ae3f1043fd7276cbdf7f9b,80dd97954ddf3edd22d4cb21f0ac31b7ffed6bbf",19,"2066454935,1683936,1882003"
5d8b271c412f4be0c689bdfde93916efa0951deb,Molecular Property Prediction: A Multilevel Quantum Interactions Modeling Perspective,predicting molecular properties eg atomization energy is an essential issue in quantum chemistry which could speed up much research progress such as drug designing and substance discovery traditional studies based on density functional theory dft in physics are proved to be timeconsuming for predicting large number of molecules recently the machine learning methods which consider much rulebased information have also shown potentials for this issue however the complex inherent quantum interactions of molecules are still largely underexplored by existing solutions in this paper we propose a generalizable and transferable multilevel graph convolutional neural network mgcn for molecular property prediction specifically we represent each molecule as a graph to preserve its internal structure moreover the welldesigned hierarchical graph neural network directly extracts features from the conformation and spatial information followed by the multilevel interactions as a consequence the multilevel overall representations can be utilized to make the prediction extensive experiments on both datasets of equilibrium and offequilibrium molecules demonstrate the effectiveness of our model furthermore the detailed results also prove that mgcn is generalizable and transferable for the prediction,2019,43,2019-06-25,"Property Graph, Graph Algorithms, Graph Neural Networks, Graph Similarity, Molecular Properties, Quantum Chemistry, Density Functional Theory Dft, Large Number, Existing Solutions, Molecular Property Prediction, Spatial Information",AAAI Conference on Artificial Intelligence,"46655401,50384136,2144447281,3374015,103155734,47648651","Chengqiang Lu,Qi Liu,Chao Wang,Zhenya Huang,Peize Lin,Lixin He",46655401,"b473e91cbe80c8b46451b49153cd5f93030480ab,be88a24e9b6e26f10d4d84183c8f05ba33eb60c0,4d1fdd81f033cd58f3723bfc61e7d12079647a7a,30bf7d1694641f6bb3289d980a2326183ad560f0,3a74bed911ccf213d9595b2b02a5b1c4ac4dcaf8,d63b884d5ebc739f6e1bdf861fa9276260781404,0a829289a16ae48837cc2905635435db98bacc76,bc9fde639ceaceafe84c0ad94a2cd7badef141d3,0a537eaf4444f0bd59f62a550430edab9d0a820d,32c1e0f9ef6f1e337fe4aa2a4907314e5a3f4a5b,07c4549be429a52274bc0ec083bf5598a3e5c365,a8370aaa0ba9d69b7e83d5785c27b11be973cd84,4d044f0c84be360b26398b58027e618d5f08a83f,122a535ae02d4e0fa2512f9c3be77eae6a007266,3527f43e8156d1bf5a0998405047c98036d172f0,ecef432e7f6c9f431d5b34706a8de1fdebec46f9,17fca92ffd527c78c5dc6c7953e96671743807fa,d65d64c3f6ea322d9e85138fe5c8e85acbf661e3,28816b148281af9ba41469b4c69dd69c2afd2b95,4e6bba65f7636a655c778a3e54cc58e148468963,8640a08cdb759d52da026f6d89521e36c61b5910,b31ce19f12bbf6058f4fe849d9f3654932353f20,b15e942e526e4a03ecd0af31cbdf9b43bf81a829,00d681cfff7f0224ace607e515f4ed510e792df9,d71c0365685300539109e0fd07e34c9dd9beff75,69381b5efd97e7c55f51c2730caccab3d632d4d2,02a88547d6f6022bebc9aba6723a310cdf132f3f,521e5c337be51b8f8fdb858580bb46a0545ab1f9,bcad76ae5cea05bad85fd6b2b08aa30a801d9a3b,fa9645e0491164fe78890073548284604958f383,91d6e8ba5dd90b02fe3bd870b19da13a6167af53,b1706b4463701169d339c9c791cae0d4ec367b50,6eb5744bd933dcd29ff4d79e340cf890272ef099,a5400a6f415d65aac1312edd2ca6b7361c241f85,7c70459d56214a7a3202732670f5ce726508eff6,d9f836a2062864e4808e12224e2286a353498202,7ad94b0ec31d38b7915e88f743b573edb8efce5b,91fc647899f801c9d351349ce73779918f90a713,5bc511aa30f72720260d792e57537379fb04c395,39af4070dca3221d275898c55884167bc03fe73d,8f7a7aea33c942e626832f014a831361b7fa39c7,bc6dbcaf4d2c76e618ae3f1043fd7276cbdf7f9b,247dec05283a1a521f99253a6cca6a5858cac0d2",19,"1716522,1740155,2288285"
07c4549be429a52274bc0ec083bf5598a3e5c365,Modeling and Discovering Vulnerabilities with Code Property Graphs,the vast majority of security breaches encountered today are a direct result of insecure code consequently the protection of computer systems critically depends on the rigorous identification of vulnerabilities in software a tedious and errorprone process requiring significant expertise unfortunately a single flaw suffices to undermine the security of a system and thus the sheer amount of code to audit plays into the attackers cards in this paper we present a method to effectively mine large amounts of source code for vulnerabilities to this end we introduce a novel representation of source code called a code property graph that merges concepts of classic program analysis namely abstract syntax trees control flow graphs and program dependence graphs into a joint data structure this comprehensive representation enables us to elegantly model templates for common vulnerabilities with graph traversals that for instance can identify buffer overflows integer overflows format string vulnerabilities or memory disclosures we implement our approach using a popular graph database and demonstrate its efficacy by identifying  previously unknown vulnerabilities in the source code of the linux kernel,2014,18,2014-05-18,"Property Graph, Graph Pattern Matching, Graph Database, Graph Similarity, Security Breaches, Insecure Code, Computer Systems, Significant Expertise, Large Amounts, Source Code, Classic Program Analysis, Program Dependence Graphs, Common Vulnerabilities, Graph Traversals, Format String Vulnerabilities, Memory Disclosures, Previously Unknown Vulnerabilities",IEEE Symposium on Security and Privacy,"2944486,2641234,79405068,144825749","Fabian Yamaguchi,N. Golde,Dan Arp,Konrad Rieck",2944486,"91b63db746becca15090963a8990dfe2b5103799,b31ce19f12bbf6058f4fe849d9f3654932353f20,59a268ee97ba83c04abbe02769bd61dcd3747d25,7a62457a9942e45429d4b5d9d8370210df3875ec,8cfb3412f1bd6025e14f4665c5723ed60a5d8061,00d681cfff7f0224ace607e515f4ed510e792df9,69381b5efd97e7c55f51c2730caccab3d632d4d2,db9967871249ffd77adc0c0cc16154ccc37d09ad,f117c6f12d067bd66dad40996b3931c069daa2da,dac7344737cb824634f757aede2dd46a6eed204b,ce8a567f7578e8b6c9dc6510e2b058bd3a02019c,5ccd1eefd94af0a20e10a0a5e0da22aa2f481c76,0fbe5e2f2e2b8e2b2e2f0013e2e07cac2e5ce926,da619a6c524f5ab800b44c8728db3cef3d3b25d9,dba7c73503c4b7abad96aaa4a167fd7e701c4059,4e6bba65f7636a655c778a3e54cc58e148468963,e3b9ffde49c9b4a57b09a651187a2e194cb35693,bf5a42b53d156c0811e88e60d2a49f9fd9367cae",14,"2336606,9138305,144461639"
d71c0365685300539109e0fd07e34c9dd9beff75,The Multiscale Laplacian Graph Kernel,many real world graphs such as the graphs of molecules exhibit structure at multiple different scales but most existing kernels between graphs are either purely local or purely global in character in contrast by building a hierarchy of nested subgraphs the multiscale laplacian graph kernels mlg kernels that we define in this paper can account for structure at a range of different scales at the heart of the mlg construction is another new graph kernel called the feature space laplacian graph kernel flg kernel which has the property that it can lift a base kernel defined on the vertices of two graphs to a kernel between the graphs the mlg kernel applies such flg kernels to subgraphs recursively to make the mlg kernel computationally feasible we also introduce a randomized projection procedure similar to the nystro m method but for rkhs operators,2016,10,2016-03-01,"Property Graph, Graph Embeddings, Graph Analytics, Graph Querying, Multiple Different Scales, Nested Subgraphs, Mlg Kernels, Different Scales, Rkhs Operators",Neural Information Processing Systems,"2834541,7823285","R. Kondor,Horace Pan",2834541,"4e6bba65f7636a655c778a3e54cc58e148468963,dba7c73503c4b7abad96aaa4a167fd7e701c4059,b8aecf918f1c729eb2a2fa88da9eb16835daca5a,bf5a42b53d156c0811e88e60d2a49f9fd9367cae,8cfb3412f1bd6025e14f4665c5723ed60a5d8061,1c2de5fc71be2be3af28545e873605ead4d7d79b,bc9fde639ceaceafe84c0ad94a2cd7badef141d3,1bc34cb22131554ba18f6ba9e6ede5beb42939f1,94deb62af3054c49e7d80bd7eb3ed5efe990fc0b,ce8a567f7578e8b6c9dc6510e2b058bd3a02019c",16,"40362338,48918401,80193067"
b5aea8c6ebaab339b4e190decab80ab607815e8b,Schema Inference for Property Graphs,property graph instances are typically populated without defining a schema beforehand although this ensures great flexibility the lack of a schema implies to miss opportunities for query optimization data integration and analytics to name a few since several graph instances exist prior to the schema definition extracting the schema from those instances in a principled way might become a significant yet daunting task in this paper we present a novel endtoend schema inference method for property graph schemas that tackles complex and nested property values multilabeled nodes and node hierarchies our method consists of three main steps the first of which builds upon cypher queries to extract the node and edge serialization of a property graph the second step builds over a mapreduce type inference system working on the serialized output thereby obtained during the first step the third step analyzes subtypes and supertypes to infer node hierarchies we describe our schema inference pipeline and its implementation a labelsand a propertiesoriented variant finally we experimentally evaluate and compare the scalability and accuracy of our approaches on several reallife datasets to the best of our knowledge our work is the first to tackle the problem of schema inference for property graphs,2020,22,2020-09-03,"Property Graph, Graph Representation Learning, Graph Partitioning, Graph-Based Recommendation, Property Graph Instances, Great Flexibility, Query Optimization Data Integration, Property Graph Schemas, Multilabeled Nodes, Node Hierarchies, Cypher Queries, Schema Inference, Property Graphs",International Conference on Extending Database Technology,"2005517418,1699192,2058740","Hanâ Lbath,A. Bonifati,Russell Harmer",2005517418,"d65d64c3f6ea322d9e85138fe5c8e85acbf661e3,4e6bba65f7636a655c778a3e54cc58e148468963,44842bba66366522de782f537d9bc61d8868bf08,59f1df2f60280eea79d195b9c561d52a77fb24de,0ff76855604fc150ecd36bc8c3197780a8ea2b23,6998e4ae3f1e037128bc57a56dd5d7707098e6bf,61aec24ce3ce839bf08ce98e061099f2a20a50d6,3527f43e8156d1bf5a0998405047c98036d172f0,a5400a6f415d65aac1312edd2ca6b7361c241f85,3a74bed911ccf213d9595b2b02a5b1c4ac4dcaf8,689c7a86d973895a14feb984b8faa3d5581038ef,b31ce19f12bbf6058f4fe849d9f3654932353f20,e7c8fcbc24c73a576339e5f34f9f23f5ea732b3b,0a537eaf4444f0bd59f62a550430edab9d0a820d,09430c7080172d50a591cef44d85fd16e58d945e,aca6d5f3866372a4506cf15773ae298f18c3f453,07627bf7eb649220ffbcdf6bf233e3a4a76e8590,456c011594ecacdd24298a161787389ccbe4b88b,91b63db746becca15090963a8990dfe2b5103799,a8370aaa0ba9d69b7e83d5785c27b11be973cd84,b1706b4463701169d339c9c791cae0d4ec367b50,de6cf3534f39748a223b9bb2b59d2e7ffcb6ae03",20,"3407296,13290587,152290618"
63dc64fc2d23be98100f4c59e82278d838c78ef9,A Representation Learning Framework for Property Graphs,representation learning on graphs also called graph embedding has demonstrated its significant impact on a series of machine learning applications such as classification prediction and recommendation however existing work has largely ignored the rich information contained in the properties or attributes of both nodes and edges of graphs in modern applications eg those represented by property graphs to date most existing graph embedding methods either focus on plain graphs with only the graph topology or consider properties on nodes only we propose pge a graph representation learning framework that incorporates both node and edge properties into the graph embedding procedure pge uses node clustering to assign biases to differentiate neighbors of a node and leverages multiple datadriven matrices to aggregate the property information of neighbors sampled based on a biased strategy pge adopts the popular inductive model for neighborhood aggregation we provide detailed analyses on the efficacy of our method and validate the performance of pge by showing how pge achieves better embedding results than the stateoftheart graph embedding methods on benchmark applications such as node classification and link prediction over realworld datasets,2019,33,2019-07-25,"Property Graph, Graph Analytics, Graph Storage, Graph Visualization, Machine Learning Applications, Classification Prediction, Modern Applications, Property Graphs, Plain Graphs, Node Clustering, Neighborhood Aggregation, Detailed Analyses, Benchmark Applications, Realworld Datasets",Knowledge Discovery and Data Mining,"2088768581,2108844303,2145413970,1717691,2150427580","Yifan Hou,Hongzhi Chen,Changji Li,James Cheng,Ming Yang",2088768581,"1e4709c0b8fe3bf759cd64dc1ede695d6e5316f0,da619a6c524f5ab800b44c8728db3cef3d3b25d9,91fc647899f801c9d351349ce73779918f90a713,6998e4ae3f1e037128bc57a56dd5d7707098e6bf,32c1e0f9ef6f1e337fe4aa2a4907314e5a3f4a5b,57dcff5c3c15f6c5e5935ef7164c8f467a53848b,bc6dbcaf4d2c76e618ae3f1043fd7276cbdf7f9b,39af4070dca3221d275898c55884167bc03fe73d,61aec24ce3ce839bf08ce98e061099f2a20a50d6,70f7cd54b5918aed60c3d8c3a8e4aa7e8d634c41,bcad76ae5cea05bad85fd6b2b08aa30a801d9a3b,bfdc1a7d5aab0f4bce4afc9723192937c24ef5ff,91d6e8ba5dd90b02fe3bd870b19da13a6167af53,e3b9ffde49c9b4a57b09a651187a2e194cb35693,5ccd1eefd94af0a20e10a0a5e0da22aa2f481c76,3b217403302f9cb9d9685404c7646de7bc0db428,0534fc2dd13c781f02df2931d651fd39d03b8355,d154d986c3a402c207c6c0e22093f2e1a878fe71,752604994a7ca548ff2954114fc61a501d857b1c,7ad94b0ec31d38b7915e88f743b573edb8efce5b,15748c0437c3be2e464dfb6aa42d2ff5dbd5d7f7,bf5a42b53d156c0811e88e60d2a49f9fd9367cae,f47def30face829e8034a292c2e3e7a9f4240d34,82181d5c33590a81ab3b773c3948141eb22d89fb,6fa2d1873bc12d1a698ec8d0e5e32e4236f3bd2b,0a537eaf4444f0bd59f62a550430edab9d0a820d,d8b65198c37ada92cada81fe315508fc5bdbab8f,44842bba66366522de782f537d9bc61d8868bf08,de6cf3534f39748a223b9bb2b59d2e7ffcb6ae03,da95d02a50b8208a17127987dde3cdf8da455114,d427db1ba2cc92b36d16a5e5114f1027c90fff68,09430c7080172d50a591cef44d85fd16e58d945e,e3d74f13374063a86909c7b0a8105be94902b7f4",19,"1745069,46234199,107864595"
