paperId,title,abstract,year,citationCount,publicationDate,keywords,jcwName,authorId,authorName,correspondingAuthorId,citedPaperId,edition,reviewers
bc9fde639ceaceafe84c0ad94a2cd7badef141d3,GraphTrek: Asynchronous Graph Traversal for Property Graph-Based Metadata Management,property graphs are a promising data model for rich metadata management in highperformance computing hpc systems because of their ability to represent not only metadata attributes but also the relationships between them a property graph can be used to record the relationships between users jobs and data for example with unique annotations for each entity this highvolume powerlaw distributed use case is a natural fit for an outofcore distributed property graph database such a system must support live updates to ingest production information in real time lowlatency point queries for frequent metadata operations such as permission checking and largescale traversals for provenance data mining largescale property graph traversals are particularly challenging for distributed graph databases however most existing graph databases implement a levelsynchronous breadthfirst search algorithm that relies on global synchronization in each traversal step this traversal model performs well in many problem domains but a rich metadata management system is characterized by imbalanced graphs long traversal lengths and concurrent workloads each of which has the potential to introduce or exacerbate stragglers we define stragglers as abnormally slow steps or servers in a graph traversal that lead to low overall throughput for synchronous traversal algorithms the straggler problem can be mitigated by the use of asynchronous traversal algorithms asynchronous traversal has been successfully demonstrated in graph processing frameworks but such systems require the graph to be loaded into a separate batchprocessing framework in this work we propose graphtrek a general asynchronous graph traversal engine working with graph databases for processing rich metadata management in their native format we also outline a traversalaware query language and key optimizations traversalaffiliate caching and execution merging necessary for efficient performance our experiments show that the asynchronous graph traversal engine is more efficient than its synchronous counterpart in the case of hpc rich metadata processing where more servers are involved and larger traversals are needed,2015,6,2015-09-08,"Property Graph, Graph Analytics, Graph Visualization, Graph Neural Networks, Property Graphs, Rich Metadata Management, Highperformance Computing Hpc Systems, Users Jobs, Unique Annotations, Use Case, Live Updates, Production Information, Real Time, Lowlatency Point, Frequent Metadata Operations, Permission Checking, Largescale Traversals, Provenance Data Mining Largescale Property Graph Traversals, Distributed Graph Databases, Global Synchronization, Imbalanced Graphs, Long Traversal Lengths, Concurrent Workloads, Abnormally Slow Steps, Low Overall Throughput, Synchronous Traversal, Asynchronous Traversal, Graph Processing Frameworks, Graph Databases, Key Optimizations, Efficient Performance, Hpc Rich Metadata Processing, Larger Traversals",IEEE International Conference on Cluster Computing,"1804361,2797656,145311475,145111164,48289026,47557631","Dong Dai,P. Carns,R. Ross,John Jenkins,Kyle Blauer,Yong Chen",1804361,"69381b5efd97e7c55f51c2730caccab3d632d4d2,1e4709c0b8fe3bf759cd64dc1ede695d6e5316f0,8cfb3412f1bd6025e14f4665c5723ed60a5d8061,94deb62af3054c49e7d80bd7eb3ed5efe990fc0b,07c4549be429a52274bc0ec083bf5598a3e5c365,ce8a567f7578e8b6c9dc6510e2b058bd3a02019c",15,"2055760745.0,35030227.0,2235459675.0"
2ced2ac19a88439b52e519d2e6ce44cccf08e191,Motif-based Graph Self-Supervised Learning for Molecular Property Prediction,predicting molecular properties with datadriven methods has drawn much attention in recent years particularly graph neural networks gnns have demonstrated remarkable success in various molecular generation and prediction tasks in cases where labeled data is scarce gnns can be pretrained on unlabeled molecular data to first learn the general semantic and structural information before being finetuned for specific tasks however most existing selfsupervised pretraining frameworks for gnns only focus on nodelevel or graphlevel tasks these approaches cannot capture the rich information in subgraphs or graph motifs for example functional groups frequentlyoccurred subgraphs in molecular graphs often carry indicative information about the molecular properties to bridge this gap we propose motifbased graph selfsupervised learning mgssl by introducing a novel selfsupervised motif generation framework for gnns first for motif extraction from molecular graphs we design a molecule fragmentation method that leverages a retrosynthesisbased algorithm brics and additional rules for controlling the size of motif vocabulary second we design a general motifbased generative pretraining framework in which gnns are asked to make topological and label predictions this generative framework can be implemented in two different ways ie breadthfirst or depthfirst finally to take the multiscale information in molecular graphs into consideration we introduce a multilevel selfsupervised pretraining extensive experiments on various downstream benchmark tasks show that our methods outperform all stateoftheart baselines,2021,53,2021-10-03,"Property Graph, Graph-Based Recommendation, Graph Neural Networks, Graph Mining, Molecular Properties, Datadriven Methods, Recent Years, Particularly Graph Neural Networks Gnns, Remarkable Success, Labeled Data, Scarce Gnns, Unlabeled Molecular Data, Specific Tasks, Graph Motifs, Example Functional Groups, Molecular Graphs, Indicative Information, Motifbased Graph Selfsupervised Learning Mgssl, Motif Extraction, Additional Rules, Motif Vocabulary Second",Neural Information Processing Systems,"2129455190,2144831836,2144219662,46655401,153897134","Zaixin Zhang,Qi Liu,Hao Wang,Chengqiang Lu,Chee-Kong Lee",2129455190,"3789eb72c32ecf5e33442570358dd786dd67c8a2,7f5cd5b1340ac06ea38bd05373c30136a6f4c1ca,d8b65198c37ada92cada81fe315508fc5bdbab8f,32c1e0f9ef6f1e337fe4aa2a4907314e5a3f4a5b,73d4accea441aae2373828a8dc2175aa2759c38f,e7c8fcbc24c73a576339e5f34f9f23f5ea732b3b,e259ee075998eedc0b0c91c17769bf9dffeba46f,30acd43e62dbbdbe823bcc321ca1a1660ec7a622,9e3816be8cf4821d74e258de10ee471382936a30,15748c0437c3be2e464dfb6aa42d2ff5dbd5d7f7,75c364909914f17791837ec88090262aa6656d3e,456c011594ecacdd24298a161787389ccbe4b88b,689c7a86d973895a14feb984b8faa3d5581038ef,9d6cbac04c498b424dfaa5ce82ac201a180c1502,b1706b4463701169d339c9c791cae0d4ec367b50,247dec05283a1a521f99253a6cca6a5858cac0d2,cf4068a73d72ced9809a5e2462bb450bbbd47a64,2d95c27d4ed8cfb8379164888cd79c6b239250b4,ba9b6f805feb62c978d384211f910790643a023e,aca6d5f3866372a4506cf15773ae298f18c3f453,cbad0923db89f23febcbd6192ff4149289ff2ad9,d65d64c3f6ea322d9e85138fe5c8e85acbf661e3,7a62457a9942e45429d4b5d9d8370210df3875ec,6351590cf37eef826b89383fd8ccf8f1ab276559,0ff76855604fc150ecd36bc8c3197780a8ea2b23,e3b9ffde49c9b4a57b09a651187a2e194cb35693,63dc64fc2d23be98100f4c59e82278d838c78ef9,2660dcf5bd16d14862a7bbb241fa4d85ae34327f,a5400a6f415d65aac1312edd2ca6b7361c241f85,fe44200fed05f9a7c656f2245deded8fd5f5e1e6,91d6e8ba5dd90b02fe3bd870b19da13a6167af53,5ccd1eefd94af0a20e10a0a5e0da22aa2f481c76,a50f37cdd0614567ef52ffa63c70285d97630ce4,9acd1892e2e299a30fa99f82bf60fc12cfa7aad3,0c7ae2c9e8c91edd6801f5578176b28e0a0414c6,16575f23ff879e6353a55bbfbbcc54e27606bfc5,94deb62af3054c49e7d80bd7eb3ed5efe990fc0b,91fc647899f801c9d351349ce73779918f90a713,00d681cfff7f0224ace607e515f4ed510e792df9,7ad94b0ec31d38b7915e88f743b573edb8efce5b,6570ee5bd1656fddbdb030410a9d996739586067,4d044f0c84be360b26398b58027e618d5f08a83f,dbabab9bf5955558f73a37644f4bb626106a6d73,e8b7a9be9f2d0578a95319ed5841978e10429967,659d8b24e53e8adfbcb1f16b26ada2cb8afa2c85,1f47d68fe87d0b1317b34a71f98548df3f5da5ff,65499384f0947e223ec83f582366203e7aa64f1f,0608fc7e1825c4ac1f61aaa95b67f155d93b0ea4,f47def30face829e8034a292c2e3e7a9f4240d34,bf69c98fca9a9f6c1cde871beddbcdc668b77771,02a88547d6f6022bebc9aba6723a310cdf132f3f,d427db1ba2cc92b36d16a5e5114f1027c90fff68,122a535ae02d4e0fa2512f9c3be77eae6a007266",21,"47648651.0,71946151.0,80273596.0"
eb8dba325534da472170293b054596a17558c7f2,Few-Shot Graph Learning for Molecular Property Prediction,the recent success of graph neural networks has significantly boosted molecular property prediction advancing activities such as drug discovery the existing deep neural network methods usually require large training dataset for each property impairing their performance in cases especially for new molecular properties with a limited amount of experimental data which are common in real situations to this end we propose metamgnn a novel model for fewshot molecular property prediction metamgnn applies molecular graph neural network to learn molecular representations and builds a metalearning framework for model optimization to exploit unlabeled molecular information and address task heterogeneity of different molecular properties metamgnn further incorporates molecular structures attribute based selfsupervised modules and selfattentive task weights into the former framework strengthening the whole learning model extensive experiments on two public multiproperty datasets demonstrate that metamgnn outperforms a variety of stateoftheart methods,2021,100,2021-02-16,"Property Graph, Graph Mining, Graph Pattern Matching, Graph Clustering, Graph Neural Networks, Molecular Property Prediction, Advancing Activities, Drug Discovery, Large Training Dataset, New Molecular Properties, Experimental Data, Real Situations, Fewshot Molecular Property Prediction Metamgnn, Molecular Graph Neural Network, Molecular Representations, Model Optimization, Unlabeled Molecular Information, Task Heterogeneity, Different Molecular Properties, Molecular Structures Attribute Based Selfsupervised Modules, Selfattentive Task Weights, Stateoftheart Methods",The Web Conference,"2109411071,2117879943,38767143,5995871,3222580,1470716407,144539424","Zhichun Guo,Chuxu Zhang,W. Yu,John E. Herr,O. Wiest,Meng Jiang,N. Chawla",2109411071,"c48e0bd0f36c25ab83befbc7b7da369b75fd25f5,ca5931b4c08eb96d40c65e1b9f8e4db46bf0585b,3a74bed911ccf213d9595b2b02a5b1c4ac4dcaf8,de6cf3534f39748a223b9bb2b59d2e7ffcb6ae03,4d1fdd81f033cd58f3723bfc61e7d12079647a7a,8dbab8de29b183d7589be8a568bca4b31902a54b,610063bfb7cb1e634f784ebe0799d0cb45f5480c,9acd1892e2e299a30fa99f82bf60fc12cfa7aad3,9c96a700a7abff857df936783f9e12a1ab38eee5,00d681cfff7f0224ace607e515f4ed510e792df9,fe44200fed05f9a7c656f2245deded8fd5f5e1e6,0a829289a16ae48837cc2905635435db98bacc76,456c011594ecacdd24298a161787389ccbe4b88b,752604994a7ca548ff2954114fc61a501d857b1c,dbabab9bf5955558f73a37644f4bb626106a6d73,dac7344737cb824634f757aede2dd46a6eed204b,b473e91cbe80c8b46451b49153cd5f93030480ab,6eefbb79f98e902e9d2efa057bfea174843bf3dc,da95d02a50b8208a17127987dde3cdf8da455114,e3d74f13374063a86909c7b0a8105be94902b7f4,cc1e82125f7f8636b25ccdcdb63e8f812add7f87,0ebd0ad7fbedde936390eeac6aed1356876cbeff,39af4070dca3221d275898c55884167bc03fe73d,7ad94b0ec31d38b7915e88f743b573edb8efce5b,f117c6f12d067bd66dad40996b3931c069daa2da,521e5c337be51b8f8fdb858580bb46a0545ab1f9,91b63db746becca15090963a8990dfe2b5103799,6570ee5bd1656fddbdb030410a9d996739586067,91fc647899f801c9d351349ce73779918f90a713,ecef432e7f6c9f431d5b34706a8de1fdebec46f9,59f1df2f60280eea79d195b9c561d52a77fb24de,75fb60dee6641656fc4c1b663bb95d1aa91c6798,70f7cd54b5918aed60c3d8c3a8e4aa7e8d634c41,cbad0923db89f23febcbd6192ff4149289ff2ad9,6351590cf37eef826b89383fd8ccf8f1ab276559,bcad76ae5cea05bad85fd6b2b08aa30a801d9a3b,78e40584f0d149bf6f98beb5561b7b83cb68e1b1,ce8a567f7578e8b6c9dc6510e2b058bd3a02019c,2660dcf5bd16d14862a7bbb241fa4d85ae34327f,bc6dbcaf4d2c76e618ae3f1043fd7276cbdf7f9b,18d87bff073687c025f9bd23ab2dfb20d5f72a66,d65d64c3f6ea322d9e85138fe5c8e85acbf661e3,b1706b4463701169d339c9c791cae0d4ec367b50,9e3816be8cf4821d74e258de10ee471382936a30,44842bba66366522de782f537d9bc61d8868bf08,247dec05283a1a521f99253a6cca6a5858cac0d2,28816b148281af9ba41469b4c69dd69c2afd2b95,15748c0437c3be2e464dfb6aa42d2ff5dbd5d7f7,0a537eaf4444f0bd59f62a550430edab9d0a820d,933baeec555352784848a93284c9dd0e79477759,122a535ae02d4e0fa2512f9c3be77eae6a007266,30acd43e62dbbdbe823bcc321ca1a1660ec7a622,80dd97954ddf3edd22d4cb21f0ac31b7ffed6bbf,0534fc2dd13c781f02df2931d651fd39d03b8355,17fca92ffd527c78c5dc6c7953e96671743807fa,7f5cd5b1340ac06ea38bd05373c30136a6f4c1ca,3323a47e69832301f8f434119b0346fc69708915,e7c8fcbc24c73a576339e5f34f9f23f5ea732b3b,94deb62af3054c49e7d80bd7eb3ed5efe990fc0b,56092013ab20394725719910fc7d4fe2274f3d54,093e777e08d3a5474e225bbdb1a124d30434d416,7b663c42dd72e2585eed4bf7fc41739e07ce9ff3,a60a4e5f7f872b9825ddff5d379857c2091ca52b,16575f23ff879e6353a55bbfbbcc54e27606bfc5,d427db1ba2cc92b36d16a5e5114f1027c90fff68,7e631773b14d7203eb0d85742b2a850f51eb1616,02a88547d6f6022bebc9aba6723a310cdf132f3f,5bc511aa30f72720260d792e57537379fb04c395,d154d986c3a402c207c6c0e22093f2e1a878fe71,4e6bba65f7636a655c778a3e54cc58e148468963,bfdc1a7d5aab0f4bce4afc9723192937c24ef5ff,4d044f0c84be360b26398b58027e618d5f08a83f,2742192c8d7248be8423e0333a9ab1c62c98bbbd,1f8a23697562b001082b147779b5eaefd3513d0a,3bc9bb1f2218dcbd15c3b7cdfcb43077a3f30779,1f9058eb0b639d0dffae192b3ffd5d80adabf0e9,65499384f0947e223ec83f582366203e7aa64f1f,501b6c76007e700e1b82f34930d24fc04709fc9d,adf914b04914a9b856e26c575c789ba19f9f118d,0ff76855604fc150ecd36bc8c3197780a8ea2b23,ccca203382e5dd198c089a0f1d7af7bef0f694e9,1bc34cb22131554ba18f6ba9e6ede5beb42939f1,1c2de5fc71be2be3af28545e873605ead4d7d79b,e3b9ffde49c9b4a57b09a651187a2e194cb35693,8f7a7aea33c942e626832f014a831361b7fa39c7,6eb5744bd933dcd29ff4d79e340cf890272ef099,30bf7d1694641f6bb3289d980a2326183ad560f0,1fe201d9ec4d072c7af233d265927388f32d3ab3,391a5f286f814d852dddcab1b2b68e5c1af6c79e,718b5a40dba91bfa0bdfb9ac9ca4381425d2ff95,82870bc488b57cdf5ea62877109a7278af2926b3,a8370aaa0ba9d69b7e83d5785c27b11be973cd84,bc9fde639ceaceafe84c0ad94a2cd7badef141d3,5ccd1eefd94af0a20e10a0a5e0da22aa2f481c76,8e6d0ed32aaa5e3d7c598d5a2ace76eab8485801,1a901533b09269bafa1222ad5f2f5eb0279915ac,0c7ae2c9e8c91edd6801f5578176b28e0a0414c6,046eb47d56beb8069b0098e3d01608f81ebb6849,b080d072cfde697180db3234da08903c092e72c3,aca6d5f3866372a4506cf15773ae298f18c3f453",21,"145451018.0,2378027.0,46655401.0"
56092013ab20394725719910fc7d4fe2274f3d54,GPS-Net: Graph Property Sensing Network for Scene Graph Generation,scene graph generation sgg aims to detect objects in an image along with their pairwise relationships there are three key properties of scene graph that have been underexplored in recent works namely the edge direction information the difference in priority between nodes and the longtailed distribution of relationships accordingly in this paper we propose a graph property sensing network gpsnet that fully explores these three properties for sgg first we propose a novel message passing module that augments the node feature with nodespecific contextual information and encodes the edge direction information via a trilinear model second we introduce a node priority sensitive loss to reflect the difference in priority between nodes during training this is achieved by designing a mapping function that adjusts the focusing parameter in the focal loss third since the frequency of relationships is affected by the longtailed distribution problem we mitigate this issue by first softening the distribution and then enabling it to be adjusted for each subjectobject pair according to their visual appearance systematic experiments demonstrate the effectiveness of the proposed techniques moreover gpsnet achieves stateoftheart performance on three popular databases vg oi and vrd by significant gains under various settings and metrics the code and models are available at httpsgithubcomtaksaugpsnet,2020,108,2020-03-29,"Property Graph, Graph Mining, Graph Similarity, Graph Embeddings, Scene Graph Generation Sgg, Scene Graph, Recent Works, Nodespecific Contextual Information, Significant Gains",Computer Vision and Pattern Recognition,"2115252929,144116132,1882003,143719920","Xin Lin,Changxing Ding,Jinquan Zeng,D. Tao",2115252929,"8cfb3412f1bd6025e14f4665c5723ed60a5d8061,ce8a567f7578e8b6c9dc6510e2b058bd3a02019c,d63b884d5ebc739f6e1bdf861fa9276260781404,e8b7a9be9f2d0578a95319ed5841978e10429967,f47def30face829e8034a292c2e3e7a9f4240d34,1597449a7f64b6bd24639b4deab96c8a8c184177,65499384f0947e223ec83f582366203e7aa64f1f,093e777e08d3a5474e225bbdb1a124d30434d416,b473e91cbe80c8b46451b49153cd5f93030480ab,247dec05283a1a521f99253a6cca6a5858cac0d2,94deb62af3054c49e7d80bd7eb3ed5efe990fc0b,f117c6f12d067bd66dad40996b3931c069daa2da,122a535ae02d4e0fa2512f9c3be77eae6a007266,82181d5c33590a81ab3b773c3948141eb22d89fb,2660dcf5bd16d14862a7bbb241fa4d85ae34327f,75c364909914f17791837ec88090262aa6656d3e,c48e0bd0f36c25ab83befbc7b7da369b75fd25f5,09430c7080172d50a591cef44d85fd16e58d945e,521e5c337be51b8f8fdb858580bb46a0545ab1f9,6998e4ae3f1e037128bc57a56dd5d7707098e6bf,78e40584f0d149bf6f98beb5561b7b83cb68e1b1,cc1e82125f7f8636b25ccdcdb63e8f812add7f87,47bca586abefde3b796b65c986269f082fcb59c5,91b63db746becca15090963a8990dfe2b5103799,e3d74f13374063a86909c7b0a8105be94902b7f4,cf4068a73d72ced9809a5e2462bb450bbbd47a64,8894d431a768a35dc7ca4d762ebdba4f407b978c,6fa2d1873bc12d1a698ec8d0e5e32e4236f3bd2b,c24d47ff95cd4bda073c75ec24ececaa3b10c995,b34fc78de28be598e21118d7cb9d84d63374addc,be88a24e9b6e26f10d4d84183c8f05ba33eb60c0,16575f23ff879e6353a55bbfbbcc54e27606bfc5,fa9645e0491164fe78890073548284604958f383,82870bc488b57cdf5ea62877109a7278af2926b3,501b6c76007e700e1b82f34930d24fc04709fc9d,a60a4e5f7f872b9825ddff5d379857c2091ca52b,873b045dea18c2092b2c11e7b9542dd93ce84d65,243d553f1fc5b7ee8cfb6f49629f3a0a32b2c5c5,bc9fde639ceaceafe84c0ad94a2cd7badef141d3,48fc9c42522184c652742255fdf31f7b9ed7ebae,70f7cd54b5918aed60c3d8c3a8e4aa7e8d634c41,3527f43e8156d1bf5a0998405047c98036d172f0,0a829289a16ae48837cc2905635435db98bacc76,1f9058eb0b639d0dffae192b3ffd5d80adabf0e9,e7c8fcbc24c73a576339e5f34f9f23f5ea732b3b,ca5931b4c08eb96d40c65e1b9f8e4db46bf0585b,4d1fdd81f033cd58f3723bfc61e7d12079647a7a,2742192c8d7248be8423e0333a9ab1c62c98bbbd,69381b5efd97e7c55f51c2730caccab3d632d4d2,de6cf3534f39748a223b9bb2b59d2e7ffcb6ae03,7c70459d56214a7a3202732670f5ce726508eff6,9c96a700a7abff857df936783f9e12a1ab38eee5,a5400a6f415d65aac1312edd2ca6b7361c241f85,5bc511aa30f72720260d792e57537379fb04c395,39af4070dca3221d275898c55884167bc03fe73d,4e6bba65f7636a655c778a3e54cc58e148468963,1c2de5fc71be2be3af28545e873605ead4d7d79b,d65d64c3f6ea322d9e85138fe5c8e85acbf661e3,c7e10109fed73e523bf2a78b00e4b657004d41fc,91d6e8ba5dd90b02fe3bd870b19da13a6167af53,b31ce19f12bbf6058f4fe849d9f3654932353f20,1f8a23697562b001082b147779b5eaefd3513d0a,6aca07154c111f1c8738347d7112cad6b0bf974a,0608fc7e1825c4ac1f61aaa95b67f155d93b0ea4,1e4709c0b8fe3bf759cd64dc1ede695d6e5316f0,b080d072cfde697180db3234da08903c092e72c3,dba7c73503c4b7abad96aaa4a167fd7e701c4059,8e6d0ed32aaa5e3d7c598d5a2ace76eab8485801,456c011594ecacdd24298a161787389ccbe4b88b,a8370aaa0ba9d69b7e83d5785c27b11be973cd84,63dc64fc2d23be98100f4c59e82278d838c78ef9,efca2a32ce9c7a808c2c3efcc2c3dac032dfc8ea,d427db1ba2cc92b36d16a5e5114f1027c90fff68,59a268ee97ba83c04abbe02769bd61dcd3747d25,933baeec555352784848a93284c9dd0e79477759,0ff76855604fc150ecd36bc8c3197780a8ea2b23,6eb5744bd933dcd29ff4d79e340cf890272ef099,0a537eaf4444f0bd59f62a550430edab9d0a820d,5d8b271c412f4be0c689bdfde93916efa0951deb,0fbe5e2f2e2b8e2b2e2f0013e2e07cac2e5ce926,659d8b24e53e8adfbcb1f16b26ada2cb8afa2c85,0534fc2dd13c781f02df2931d651fd39d03b8355,da619a6c524f5ab800b44c8728db3cef3d3b25d9,42fe18be6e9ff2c11e5b2347c93e131c9abc7a51,dac7344737cb824634f757aede2dd46a6eed204b,02a88547d6f6022bebc9aba6723a310cdf132f3f,d154d986c3a402c207c6c0e22093f2e1a878fe71,80dd97954ddf3edd22d4cb21f0ac31b7ffed6bbf,17fca92ffd527c78c5dc6c7953e96671743807fa,4d044f0c84be360b26398b58027e618d5f08a83f,bf5a42b53d156c0811e88e60d2a49f9fd9367cae,3789eb72c32ecf5e33442570358dd786dd67c8a2,bc6dbcaf4d2c76e618ae3f1043fd7276cbdf7f9b,57dcff5c3c15f6c5e5935ef7164c8f467a53848b,7a62457a9942e45429d4b5d9d8370210df3875ec,d9f836a2062864e4808e12224e2286a353498202,b15e942e526e4a03ecd0af31cbdf9b43bf81a829,ba9b6f805feb62c978d384211f910790643a023e,dbabab9bf5955558f73a37644f4bb626106a6d73,b1706b4463701169d339c9c791cae0d4ec367b50,0026ea8a0fd31bdc959a4b9ed4d449f3015be8d1,adf914b04914a9b856e26c575c789ba19f9f118d,00d681cfff7f0224ace607e515f4ed510e792df9,07c4549be429a52274bc0ec083bf5598a3e5c365,7f5cd5b1340ac06ea38bd05373c30136a6f4c1ca,4e13a8e8ba8d33e15ed037bfca7c651047533990,391a5f286f814d852dddcab1b2b68e5c1af6c79e,752604994a7ca548ff2954114fc61a501d857b1c",20,"2144219662.0,2283098327.0,2286440807.0"
0a3764d605a317c5618a8cc4e83589d87bfff3b9,GeomGCL: Geometric Graph Contrastive Learning for Molecular Property Prediction,recently many efforts have been devoted to applying graph neural networks gnns to molecular property prediction which is a fundamental task for computational drug and material discovery one of major obstacles to hinder the successful prediction of molecular property by gnns is the scarcity of labeled data though graph contrastive learning gcl methods have achieved extraordinary performance with insufficient labeled data most focused on designing data augmentation schemes for general graphs however the fundamental property of a molecule could be altered with the augmentation method like random perturbation on molecular graphs whereas the critical geometric information of molecules remains rarely explored under the current gnn and gcl architectures to this end we propose a novel graph contrastive learning method utilizing the geometry of the molecule across d and d views which is named geomgcl specifically we first devise a dualview geometric message passing network geommpnn to adaptively leverage the rich information of both d and d graphs of a molecule the incorporation of geometric properties at different levels can greatly facilitate the molecular representation learning then a novel geometric graph contrastive scheme is designed to make both geometric views collaboratively supervise each other to improve the generalization ability of geommpnn we evaluate geomgcl on various downstream property prediction tasks via a finetune process experimental results on seven reallife molecular datasets demonstrate the effectiveness of our proposed geomgcl against stateoftheart baselines,2021,62,2021-09-24,"Property Graph, Graph Neural Networks, Graph Visualization, Graph Algorithms, Molecular Property Prediction, Major Obstacles, Molecular Property, Labeled Data, Graph Contrastive Learning Gcl Methods, Extraordinary Performance, Insufficient Labeled Data, Data Augmentation Schemes, General Graphs, Random Perturbation, Molecular Graphs, Network Geommpnn, Geometric Properties, Different Levels, Seven Reallife Molecular Datasets, Stateoftheart Baselines",AAAI Conference on Artificial Intelligence,"2133437625,2336606,41157498,1721158,2093122576","Shuangli Li,Jingbo Zhou,Tong Xu,D. Dou,Hui Xiong",2133437625,"16575f23ff879e6353a55bbfbbcc54e27606bfc5,7ad94b0ec31d38b7915e88f743b573edb8efce5b,cc1e82125f7f8636b25ccdcdb63e8f812add7f87,07627bf7eb649220ffbcdf6bf233e3a4a76e8590,da619a6c524f5ab800b44c8728db3cef3d3b25d9,3527f43e8156d1bf5a0998405047c98036d172f0,78e40584f0d149bf6f98beb5561b7b83cb68e1b1,bc6dbcaf4d2c76e618ae3f1043fd7276cbdf7f9b,f117c6f12d067bd66dad40996b3931c069daa2da,5ccd1eefd94af0a20e10a0a5e0da22aa2f481c76,4e13a8e8ba8d33e15ed037bfca7c651047533990,1a901533b09269bafa1222ad5f2f5eb0279915ac,63dc64fc2d23be98100f4c59e82278d838c78ef9,57dcff5c3c15f6c5e5935ef7164c8f467a53848b,1e4709c0b8fe3bf759cd64dc1ede695d6e5316f0,02a88547d6f6022bebc9aba6723a310cdf132f3f,48fc9c42522184c652742255fdf31f7b9ed7ebae,efca2a32ce9c7a808c2c3efcc2c3dac032dfc8ea,e3d74f13374063a86909c7b0a8105be94902b7f4,0ff76855604fc150ecd36bc8c3197780a8ea2b23,2d95c27d4ed8cfb8379164888cd79c6b239250b4,aca6d5f3866372a4506cf15773ae298f18c3f453,b6b7fea1846e85ac1e3c7e3adda6e65b127d0368,122a535ae02d4e0fa2512f9c3be77eae6a007266,94deb62af3054c49e7d80bd7eb3ed5efe990fc0b,73d4accea441aae2373828a8dc2175aa2759c38f,b473e91cbe80c8b46451b49153cd5f93030480ab,adf914b04914a9b856e26c575c789ba19f9f118d,bfdc1a7d5aab0f4bce4afc9723192937c24ef5ff,75c364909914f17791837ec88090262aa6656d3e,f47def30face829e8034a292c2e3e7a9f4240d34,0534fc2dd13c781f02df2931d651fd39d03b8355,91b63db746becca15090963a8990dfe2b5103799,1fe201d9ec4d072c7af233d265927388f32d3ab3,d8b65198c37ada92cada81fe315508fc5bdbab8f,80dd97954ddf3edd22d4cb21f0ac31b7ffed6bbf,ca5931b4c08eb96d40c65e1b9f8e4db46bf0585b,b5aea8c6ebaab339b4e190decab80ab607815e8b,5d8b271c412f4be0c689bdfde93916efa0951deb,e3b9ffde49c9b4a57b09a651187a2e194cb35693,a8370aaa0ba9d69b7e83d5785c27b11be973cd84,4e6bba65f7636a655c778a3e54cc58e148468963,6eefbb79f98e902e9d2efa057bfea174843bf3dc,1f9058eb0b639d0dffae192b3ffd5d80adabf0e9,9acd1892e2e299a30fa99f82bf60fc12cfa7aad3,82870bc488b57cdf5ea62877109a7278af2926b3,da95d02a50b8208a17127987dde3cdf8da455114,752604994a7ca548ff2954114fc61a501d857b1c,dbabab9bf5955558f73a37644f4bb626106a6d73,ca0e479ba2327f71e842d033b6b48b082962cc6a,2742192c8d7248be8423e0333a9ab1c62c98bbbd,8894d431a768a35dc7ca4d762ebdba4f407b978c,59f1df2f60280eea79d195b9c561d52a77fb24de,eb8dba325534da472170293b054596a17558c7f2,b8aecf918f1c729eb2a2fa88da9eb16835daca5a,6289d1271ff8176888d971bd8468dc5495b533f0,3789eb72c32ecf5e33442570358dd786dd67c8a2,391a5f286f814d852dddcab1b2b68e5c1af6c79e,b34fc78de28be598e21118d7cb9d84d63374addc,1597449a7f64b6bd24639b4deab96c8a8c184177,046eb47d56beb8069b0098e3d01608f81ebb6849,32c1e0f9ef6f1e337fe4aa2a4907314e5a3f4a5b",21,"1470716407.0,1740261.0,2285816475.0"
