paperId,title,abstract,year,citationCount,publicationDate,keywords,jcwName,authorId,authorName,correspondingAuthorId,citedPaperId,edition,reviewers
2ac3791b6a89763c509976d1f876eecc00e64fd5,DuckPGQ: Efficient Property Graph Queries in an analytical RDBMS,"In the past decade, property graph databases have emerged as a growing niche in data management. Many native graph systems and query languages have been created, but the functionality and performance still leave much room for improvement. The upcoming SQL:2023 will introduce the Property Graph Queries (SQL/PGQ) sub-language, giving relational systems the opportunity to standard-ize graph queries, and provide mature graph query functionality. We argue that (i) competent graph data systems must build on all technology that makes up a state-of-the-art relational system, (ii) the graph use case requires the addition to that of a many-source/destination path-finding algorithm and compact graph rep-resentation, and (iii) incites research in practical worst-case-optimal joins and factorized query processing techniques. We outline our design of DuckPGQ that follows this recipe, by adding efficient SQL/PGQ support to the popular open-source “embeddable analytics” relational database system DuckDB, also originally developed at CWI. Our design aims at minimizing techni-cal debt using an approach that relies on efficient vectorized UDFs. We benchmark DuckPGQ showing encouraging performance and scalability on large graph data sets, but also reinforcing the need for future research under (iii).",2023,2,,"Graph similarity, Graph algorithms, Graph clustering, Graph querying, Graph partitioning, Property Graph",Conference on Innovative Data Systems Research,"2219955175,2170409878,3254764,1687211","Daniel ten Wolde,Tavneet Singh,Gábor Szárnyas,P. Boncz",2219955175,"af05f2553a9d0484a28c722811eb4993068bb5ed,3cc9c49e2680eb8396d32e1390e2d384560f2dd4",23,"1935526,143915066,2111682898"
388423474f9fd71de70c9328ca48caa26277b50f,Hierarchical Clustering for Property Graph Schema Discovery,"The property graph model is becoming increasingly popular among users and is currently employed by several open-source and commercial graph database systems. Although property graphs are widely adopted, there is a lack of understanding of their underlying schema structure. In particular, the schema discovery problem consists of extracting the schema concepts from a property graph. A property graph schema helps build a concise description of the data it represents, to make it more digestible for humans and interactive processes, as well as usable for query optimization purposes. In this paper, we address the property graph schema discovery problem and introduce the GMMSchema method based on hierarchical clustering using a Gaussian Mixture Model, which accounts for both label and property information on nodes. We experimentally analyze the accuracy and performance of GMMSchema, compared to those of its closest competitor, and showcase its superiority on several commonly used datasets, including real-world ones, such as the Covid19 knowledge graph, as well as the Fib25 and Mb6 NeuPrint graphs.",2022,4,,"Graph database, Graph algorithms, Graph pattern matching, Graph analytics, Graph querying, Property Graph",International Conference on Extending Database Technology,"1699192,31359282,2161651957","A. Bonifati,Stefania Dumbrava,Nicolas Mir",1699192,"2ac3791b6a89763c509976d1f876eecc00e64fd5,38e80ecf905f74e734f8177f663310ac74072a99,3cc9c49e2680eb8396d32e1390e2d384560f2dd4,31b07ceea9316fb8b2945e8c409a18639125a9d1",22,"2109411071,49462068,153237386"
79d77cf59739fbf09f48b421f84fd5ea65d743c6,Vu1SPG: Vulnerability detection based on slice property graph representation learning,"Vulnerability detection is an important issue in software security. Although various data-driven vulnerability detection methods have been proposed, the task remains challenging since the diversity and complexity of real-world vulnerable code in syntax and semantics make it difficult to extract vulnerable features with regular deep learning models, especially in analyzing a large program. Moreover, the fact that real-world vulnerable codes contain a lot of redundant information unrelated to vulnerabilities will further aggravate the above problem. To mitigate such challenges, we define a novel code representation named Slice Property Graph (SPG), and then propose VulSPG, a new vulnerability detection approach using the improved R-GCN model with triple attention mechanism to identify potential vulnerabilities in SPG. Our approach has at least two advantages over other methods. First, our proposed SPG can reflect the rich semantics and explicit structural information that may be relevance to vulnerabilities, while eliminating as much irrelevant information as possible to reduce the complexity of graph. Second, VulSPG incorporates triple attention mechanism in R-GCNs to achieve more effective learning of vulnerability patterns from SPG. We have extensively evaluated VulSPG on two large-scale datasets with programs from SARD and real-world projects. Experimental results prove the effectiveness and efficiency of VulSPG.",2021,10,2021-09-06,"Graph algorithms, Graph database, Graph mining, Graph partitioning, Graph indexing, Property Graph",IEEE International Symposium on Software Reliability Engineering,"1443742662,2117807802,2146501046","Weining Zheng,Yuan Jiang,Xiaohong Su",1443742662,"388423474f9fd71de70c9328ca48caa26277b50f,01c32c563dbf823708c706f9abe9753d54aeed28,3323a47e69832301f8f434119b0346fc69708915,2ac3791b6a89763c509976d1f876eecc00e64fd5,a2e52a7e9c0862d2d841e5a788f1e975e736d7c5,ae365c85a23f422300b89ef646bf6b04f2edb94e,0a3764d605a317c5618a8cc4e83589d87bfff3b9,a11a7c37cc8f958ab9f16c7b8a0722ff5177b4d4,af05f2553a9d0484a28c722811eb4993068bb5ed,2ced2ac19a88439b52e519d2e6ce44cccf08e191",21,"3254764,2115011449,144658846"
a11a7c37cc8f958ab9f16c7b8a0722ff5177b4d4,Cloud Property Graph: Connecting Cloud Security Assessments with Static Code Analysis,"In this paper, we present the Cloud Property Graph (CloudPG), which bridges the gap between static code analysis and runtime security assessment of cloud services. The CloudPG is able to resolve data flows between cloud applications deployed on different resources, and contextualizes the graph with runtime information, such as encryption settings. To provide a vendorand technology-independent representation of a cloud service's security posture, the graph is based on an ontology of cloud resources, their functionalities and security features. We show, using an example, that our CloudPG framework can be used by security experts to identify weaknesses in their cloud deployments, spanning multiple vendors or technologies, such as AWS, Azure and Kubernetes. This includes misconfigurations, such as publicly accessible storages or undesired data flows within a cloud service, as restricted by regulations such as GDPR.",2021,9,2021-09-01,"Property graph schema, Graph database, Graph neural networks, Graph-based recommendation, Property graph query languages, Property Graph",IEEE International Conference on Cloud Computing,"3223911,39391802,49462068,50460699","Christian Banse,Immanuel Kunz,Angelika Schneider,Konrad Weiss",3223911,"2ac3791b6a89763c509976d1f876eecc00e64fd5,2ced2ac19a88439b52e519d2e6ce44cccf08e191,0a3764d605a317c5618a8cc4e83589d87bfff3b9,79d77cf59739fbf09f48b421f84fd5ea65d743c6,2a47759c48bf8d14d2caa54bcc4bd03c1eee6135,af05f2553a9d0484a28c722811eb4993068bb5ed,86e9b0585c8b866665de18b2744d69aefff3e16d,3323a47e69832301f8f434119b0346fc69708915,a2e52a7e9c0862d2d841e5a788f1e975e736d7c5",21,"1701081,1762869,2693065"
47bca586abefde3b796b65c986269f082fcb59c5,Property Graph Schema Optimization for Domain-Specific Knowledge Graphs,"Enterprises are creating domain-specific knowledge graphs by curating and integrating their business data from multiple sources. Ontologies provide a semantic abstraction for such knowledge graphs to describe their data in terms of the entities involved and their relationships. There has been a lot of effort to build systems that enable efficient querying over knowledge graphs, represented as property graphs. However the problem of schema optimization in the property graph setting has been largely ignored. In this work, we show that graph schema design has significant impact on query performance, and propose two algorithms to generate an optimized property graph schema from the domain ontology. To the best of our knowledge, we are the first to present an ontology-driven approach for property graph schema optimization. The rich semantic relationships in an ontology contain a variety of opportunities to reduce edge traversals and consequently improve the graph query performance. Our experimental study with two real-world knowledge graphs shows that our algorithms produce high-quality schemas, achieving up to 2 orders of magnitude speed-up compared to alternative schema designs.",2020,8,2020-03-25,"Graph pattern matching, Property graph schema, Graph visualization, Graph storage, Graph querying, Property Graph",IEEE International Conference on Data Engineering,"40536846,147869186,1949818,3226264,143972996","Chuan Lei,R. Alotaibi,A. Quamar,Vasilis Efthymiou,Fatma Özcan",40536846,"3323a47e69832301f8f434119b0346fc69708915,28b5dfe6035013e9345ec4a3eef5f0c5307a3fcb,86e9b0585c8b866665de18b2744d69aefff3e16d,0ebd0ad7fbedde936390eeac6aed1356876cbeff,0a3764d605a317c5618a8cc4e83589d87bfff3b9,2ac3791b6a89763c509976d1f876eecc00e64fd5,1f47d68fe87d0b1317b34a71f98548df3f5da5ff,6351590cf37eef826b89383fd8ccf8f1ab276559",20,"13290587,35132120,1703189"
501b6c76007e700e1b82f34930d24fc04709fc9d,A Property Graph Data Model for a Context-Aware Design Assistant,,2019,9,2019-07-08,"Graph mining, Graph partitioning, Graph visualization, Property graph schema, Graph pattern matching, Property Graph",Product Lifecycle Management,"2274274,47464238,2581628,1569407237","R. Pinquié,P. Véron,Frédéric Segonds,Thomas Zynda",2274274,"a50f37cdd0614567ef52ffa63c70285d97630ce4,0ff76855604fc150ecd36bc8c3197780a8ea2b23,7b663c42dd72e2585eed4bf7fc41739e07ce9ff3,86e9b0585c8b866665de18b2744d69aefff3e16d,44842bba66366522de782f537d9bc61d8868bf08,122a535ae02d4e0fa2512f9c3be77eae6a007266,2d95c27d4ed8cfb8379164888cd79c6b239250b4,9c96a700a7abff857df936783f9e12a1ab38eee5,6351590cf37eef826b89383fd8ccf8f1ab276559",19,"2108684717,2593963,2359832"
8640a08cdb759d52da026f6d89521e36c61b5910,CPGVA: Code Property Graph based Vulnerability Analysis by Deep Learning,"The vast majority of security breaches encountered recent years are direct result of insecure source code. Therefore, the protection of software critically depends on the identification of security defect in source cod. The development and progress of relative technologies depend on the analysts' understanding of the safety issues and the accumulation of long-term experience, which provides a technical basis for the development of vulnerability analysis, but difficult to meet the growing demand of the code security industry. With the maturity of big data technology, the development of natural language processing, deep learning and data mining technology provided new ideas for vulnerability analysis. This paper exploited deep learning methods to review source code on basis of code property graph. We implemented our approach on public datasets Software Assurance Reference Dataset (SARD) of C/C++ command injection and compared with current popular methods, which proved that the proposed code property graph based vulnerability analysis by deep learning (CPGVA) method outper-formed the state of art deep learning source code defect analysis method with the improvement of about 4.5%, 4.2%, 1.7%, 7.9%, 8.1% respectively in femeasure, precision, false positive rate, true positive rate and false negative rate.",2018,28,2018-08-01,"Property graph query languages, Graph-based recommendation, Graph visualization, Graph database, Graph querying, Property Graph",International Conference on Advanced Infocomm Technology,"2108684717,2285618955,2288582453,2055760745,2285233261","Xiaomeng Wang,Tao Zhang,Runpu Wu,Wei Xin,Changyu Hou",2108684717,"08257eb1faa19c29ddcc31d7d749c9bd262213c5,9c96a700a7abff857df936783f9e12a1ab38eee5,b5aea8c6ebaab339b4e190decab80ab607815e8b,15748c0437c3be2e464dfb6aa42d2ff5dbd5d7f7,a11a7c37cc8f958ab9f16c7b8a0722ff5177b4d4,0ebd0ad7fbedde936390eeac6aed1356876cbeff,689c7a86d973895a14feb984b8faa3d5581038ef,6289d1271ff8176888d971bd8468dc5495b533f0,70f7cd54b5918aed60c3d8c3a8e4aa7e8d634c41,86e9b0585c8b866665de18b2744d69aefff3e16d,01c32c563dbf823708c706f9abe9753d54aeed28,7e631773b14d7203eb0d85742b2a850f51eb1616,0a3764d605a317c5618a8cc4e83589d87bfff3b9,0534fc2dd13c781f02df2931d651fd39d03b8355,91d6e8ba5dd90b02fe3bd870b19da13a6167af53,31b07ceea9316fb8b2945e8c409a18639125a9d1,ae365c85a23f422300b89ef646bf6b04f2edb94e,7c70459d56214a7a3202732670f5ce726508eff6,63dc64fc2d23be98100f4c59e82278d838c78ef9,6351590cf37eef826b89383fd8ccf8f1ab276559,bfdc1a7d5aab0f4bce4afc9723192937c24ef5ff,873b045dea18c2092b2c11e7b9542dd93ce84d65,39af4070dca3221d275898c55884167bc03fe73d,8b229216a36507730f9911433effab08c700195a,388423474f9fd71de70c9328ca48caa26277b50f,2a47759c48bf8d14d2caa54bcc4bd03c1eee6135,da95d02a50b8208a17127987dde3cdf8da455114,44842bba66366522de782f537d9bc61d8868bf08",18,"1694512,47464238,2861212"
a8370aaa0ba9d69b7e83d5785c27b11be973cd84,Who Controls the Internet?: Analyzing Global Threats using Property Graph Traversals,"The Internet is built on top of intertwined network services, e.g., email, DNS, and content distribution networks operated by private or governmental organizations. Recent events have shown that these organizations may, knowingly or unknowingly, be part of global-scale security incidents including state-sponsored mass surveillance programs and large-scale DDoS attacks. For example, in March 2015 the Great Cannon attack has shown that an Internet service provider can weaponize millions of Web browsers and turn them into DDoS bots by injecting malicious JavaScript code into transiting TCP connections. While attack techniques and root cause vulnerabilities are routinely studied, we still lack models and algorithms to study the intricate dependencies between services and providers, reason on their abuse, and assess the attack impact. To close this gap, we present a technique that models services, providers, and dependencies as a property graph. Moreover, we present a taint-style propagation-based technique to query the model, and present an evaluation of our framework on the top 100k Alexa domains.",2017,29,2017-04-03,"Graph modeling, Graph-based recommendation, Graph indexing, Graph representation learning, Property graph query languages, Property Graph",The Web Conference,"2967882,35030227,1701081,144588806","Milivoj Simeonovski,Giancarlo Pellegrino,C. Rossow,M. Backes",2967882,"d154d986c3a402c207c6c0e22093f2e1a878fe71,0ebd0ad7fbedde936390eeac6aed1356876cbeff,91d6e8ba5dd90b02fe3bd870b19da13a6167af53,689c7a86d973895a14feb984b8faa3d5581038ef,38e80ecf905f74e734f8177f663310ac74072a99,30acd43e62dbbdbe823bcc321ca1a1660ec7a622,0a3764d605a317c5618a8cc4e83589d87bfff3b9,3cc9c49e2680eb8396d32e1390e2d384560f2dd4,6351590cf37eef826b89383fd8ccf8f1ab276559,9acd1892e2e299a30fa99f82bf60fc12cfa7aad3,44842bba66366522de782f537d9bc61d8868bf08,2d95c27d4ed8cfb8379164888cd79c6b239250b4,388423474f9fd71de70c9328ca48caa26277b50f,b5aea8c6ebaab339b4e190decab80ab607815e8b,873b045dea18c2092b2c11e7b9542dd93ce84d65,61aec24ce3ce839bf08ce98e061099f2a20a50d6,31b07ceea9316fb8b2945e8c409a18639125a9d1,ae365c85a23f422300b89ef646bf6b04f2edb94e,09430c7080172d50a591cef44d85fd16e58d945e,8640a08cdb759d52da026f6d89521e36c61b5910,d8b65198c37ada92cada81fe315508fc5bdbab8f,d9f836a2062864e4808e12224e2286a353498202,af05f2553a9d0484a28c722811eb4993068bb5ed,0534fc2dd13c781f02df2931d651fd39d03b8355,8b229216a36507730f9911433effab08c700195a,501b6c76007e700e1b82f34930d24fc04709fc9d,2742192c8d7248be8423e0333a9ab1c62c98bbbd,63dc64fc2d23be98100f4c59e82278d838c78ef9,08257eb1faa19c29ddcc31d7d749c9bd262213c5",17,"2066454935,2158301,113027219"
2742192c8d7248be8423e0333a9ab1c62c98bbbd,openCypher: New Directions in Property Graph Querying,"Cypher is a property graph query language that provides expressive and efficient querying of graph data. Originally designed and implemented within the Neo4j graph database, it is now being used by several industrial database products, as well as open-source and research projects. Since 2015, Cypher has been an open, evolving language, with the aim of becoming a fullyspecified standard with many independent implementations. We introduce Cypher and the property graph model, and then describe extensions – either actively being developed or under discussion – which will be incorporated into Cypher in the near future. These include (i) making Cypher into a fully compositional language by supporting multiple graphs and allowing graphs to be returned from queries; (ii) allowing for more complex patterns (based on regular path queries) to be expressed; and (iii) allowing for different pattern matching semantics – homomorphism, relationship isomorphism (the current default) or node isomorphism – to be configured at a query-by-query level. A subset of the proposed Cypher language extensions has already been implemented on top of Apache Spark. In the tutorial, wewill present our approach including an in-depth analysis of the challenges we faced. This includes mapping the property graph model to the Spark DataFrame abstraction and the translation of Cypher query operators into relational transformations. The tutorial will conclude with a demonstration based on a real-world graph analytical use case.",2018,12,,"Graph querying, Graph pattern matching, Graph algorithms, Graph-based recommendation, Graph visualization, Property Graph",International Conference on Extending Database Technology,"49061836,2712246,2820923,31846192,2748632,2341999","Alastair Green,Martin Junghanns,Max Kießling,Tobias Lindaaker,Stefan Plantikow,P. Selmer",49061836,"0a3764d605a317c5618a8cc4e83589d87bfff3b9,d4408e4e99c74913c7bf4b7a0aacf5bf67557c96,689c7a86d973895a14feb984b8faa3d5581038ef,a11a7c37cc8f958ab9f16c7b8a0722ff5177b4d4,af05f2553a9d0484a28c722811eb4993068bb5ed,3cc9c49e2680eb8396d32e1390e2d384560f2dd4,e259ee075998eedc0b0c91c17769bf9dffeba46f,38e80ecf905f74e734f8177f663310ac74072a99,0534fc2dd13c781f02df2931d651fd39d03b8355,08257eb1faa19c29ddcc31d7d749c9bd262213c5,86e9b0585c8b866665de18b2744d69aefff3e16d,0ebd0ad7fbedde936390eeac6aed1356876cbeff",18,"2115252929,2133437625,1962987077"
fa9645e0491164fe78890073548284604958f383,When Labels Fall Short: Property Graph Simulation via Blending of Network Structure and Vertex Attributes,"Property graphs can be used to represent heterogeneous networks with labeled (attributed) vertices and edges. Given a property graph, simulating another graph with same or greater size with the same statistical properties with respect to the labels and connectivity is critical for privacy preservation and benchmarking purposes. In this work we tackle the problem of capturing the statistical dependence of the edge connectivity on the vertex labels and using the same distribution to regenerate property graphs of the same or expanded size in a scalable manner. However, accurate simulation becomes a challenge when the attributes do not completely explain the network structure. We propose the Property Graph Model (PGM) approach that uses a label augmentation strategy to mitigate the problem and preserve the vertex label and the edge connectivity distributions as well as their correlation, while also replicating the degree distribution. Our proposed algorithm is scalable with a linear complexity in the number of edges in the target graph. We illustrate the efficacy of the PGM approach in regenerating and expanding the datasets by leveraging two distinct illustrations. Our open-source implementation is available on GitHub.",2017,6,2017-09-07,"Graph neural networks, Graph-based recommendation, Graph querying, Graph clustering, Graph analytics, Property Graph",International Conference on Information and Knowledge Management,"1762869,7617146,1792856,1950842","A. Sathanur,Sutanay Choudhury,C. Joslyn,Sumit Purohit",1762869,"44842bba66366522de782f537d9bc61d8868bf08,8f7a7aea33c942e626832f014a831361b7fa39c7,2a47759c48bf8d14d2caa54bcc4bd03c1eee6135,30acd43e62dbbdbe823bcc321ca1a1660ec7a622,0a3764d605a317c5618a8cc4e83589d87bfff3b9,a91e67f6b72a3bb9b5f0f054a252c8ee0cbfd898",17,"2434366,39391802,144161025"
6998e4ae3f1e037128bc57a56dd5d7707098e6bf,RDF Data in Property Graph Model,,2016,22,2016-11-22,"Graph embeddings, Graph storage, Graph-based recommendation, Graph algorithms, Graph clustering, Property Graph",International Conference on Metadata and Semantics Research,1777646,Dominik Tomaszuk,1777646,"32c1e0f9ef6f1e337fe4aa2a4907314e5a3f4a5b,b5aea8c6ebaab339b4e190decab80ab607815e8b,3cc9c49e2680eb8396d32e1390e2d384560f2dd4,1f47d68fe87d0b1317b34a71f98548df3f5da5ff,d8b65198c37ada92cada81fe315508fc5bdbab8f,7e631773b14d7203eb0d85742b2a850f51eb1616,2d95c27d4ed8cfb8379164888cd79c6b239250b4,28816b148281af9ba41469b4c69dd69c2afd2b95,d71c0365685300539109e0fd07e34c9dd9beff75,122a535ae02d4e0fa2512f9c3be77eae6a007266,6289d1271ff8176888d971bd8468dc5495b533f0,a91e67f6b72a3bb9b5f0f054a252c8ee0cbfd898,70f7cd54b5918aed60c3d8c3a8e4aa7e8d634c41,8b229216a36507730f9911433effab08c700195a,42fe18be6e9ff2c11e5b2347c93e131c9abc7a51,31b07ceea9316fb8b2945e8c409a18639125a9d1,28b5dfe6035013e9345ec4a3eef5f0c5307a3fcb,0ebd0ad7fbedde936390eeac6aed1356876cbeff,38e80ecf905f74e734f8177f663310ac74072a99,2ced2ac19a88439b52e519d2e6ce44cccf08e191,2a47759c48bf8d14d2caa54bcc4bd03c1eee6135,3323a47e69832301f8f434119b0346fc69708915",16,"1879114760,152290618,1861119"
bc9fde639ceaceafe84c0ad94a2cd7badef141d3,GraphTrek: Asynchronous Graph Traversal for Property Graph-Based Metadata Management,"Property graphs are a promising data model for rich metadata management in high-performance computing (HPC) systems because of their ability to represent not only metadata attributes but also the relationships between them. A property graph can be used to record the relationships between users, jobs, and data, for example, with unique annotations for each entity. This high-volume, power-law distributed use case is a natural fit for an out-of-core distributed property graph database. Such a system must support live updates (to ingest production information in real time), low-latency point queries (for frequent metadata operations such as permission checking), and large-scale traversals (for provenance data mining). Large-scale property graph traversals are particularly challenging for distributed graph databases, however. Most existing graph databases implement a ""level-synchronous"" breadth-first search algorithm that relies on global synchronization in each traversal step. This traversal model performs well in many problem domains, but a rich metadata management system is characterized by imbalanced graphs, long traversal lengths, and concurrent workloads, each of which has the potential to introduce or exacerbate stragglers. We define stragglers as abnormally slow steps (or servers) in a graph traversal that lead to low overall throughput for synchronous traversal algorithms. The straggler problem can be mitigated by the use of asynchronous traversal algorithms. Asynchronous traversal has been successfully demonstrated in graph processing frameworks, but such systems require the graph to be loaded into a separate batch-processing framework. In this work, we propose GraphTrek, a general asynchronous graph traversal engine working with graph databases for processing rich metadata management in their native format. We also outline a traversal-aware query language and key optimizations (traversal-affiliate caching and execution merging) necessary for efficient performance. Our experiments show that the asynchronous graph traversal engine is more efficient than its synchronous counterpart in the case of HPC rich metadata processing, where more servers are involved and larger traversals are needed.",2015,6,2015-09-08,"Graph embeddings, Graph querying, Graph similarity, Graph clustering, Property graph schema, Property Graph",IEEE International Conference on Cluster Computing,"1804361,2797656,145311475,145111164,48289026,47557631","Dong Dai,P. Carns,R. Ross,John Jenkins,Kyle Blauer,Yong Chen",1804361,"122a535ae02d4e0fa2512f9c3be77eae6a007266,28b5dfe6035013e9345ec4a3eef5f0c5307a3fcb,ae365c85a23f422300b89ef646bf6b04f2edb94e,e259ee075998eedc0b0c91c17769bf9dffeba46f,70f7cd54b5918aed60c3d8c3a8e4aa7e8d634c41,39af4070dca3221d275898c55884167bc03fe73d",15,"40354707,2143633281,144050371"
