paperId,title,abstract,year,citationCount,publicationDate,keywords,jcwName,authorId,authorName,correspondingAuthorId,citedPaperId,edition,reviewers
01c32c563dbf823708c706f9abe9753d54aeed28,MOTIF-Driven Contrastive Learning of Graph Representations,we propose a motifdriven contrastive framework to pretrain a graph neural network in a selfsupervised manner so that it can automatically mine motifs from large graph datasets our framework achieves stateoftheart results on various graphlevel downstream tasks with few labels like molecular property prediction,2021,90,2021-05-18,"Property Graph, Property Graph Query Languages, Graph Algorithms, Property Graph Schema, Large Graph Datasets, Stateoftheart Results, Molecular Property Prediction",AAAI Conference on Artificial Intelligence,"2145408511,3407296,1677386832,2109461904","Shichang Zhang,Ziniu Hu,Arjun Subramonian,Yizhou Sun",2145408511,"8894d431a768a35dc7ca4d762ebdba4f407b978c,933baeec555352784848a93284c9dd0e79477759,bc9fde639ceaceafe84c0ad94a2cd7badef141d3,d9f836a2062864e4808e12224e2286a353498202,fa9645e0491164fe78890073548284604958f383,1f9058eb0b639d0dffae192b3ffd5d80adabf0e9,16575f23ff879e6353a55bbfbbcc54e27606bfc5,bc6dbcaf4d2c76e618ae3f1043fd7276cbdf7f9b,4e13a8e8ba8d33e15ed037bfca7c651047533990,d154d986c3a402c207c6c0e22093f2e1a878fe71,91d6e8ba5dd90b02fe3bd870b19da13a6167af53,00d681cfff7f0224ace607e515f4ed510e792df9,b6b7fea1846e85ac1e3c7e3adda6e65b127d0368,30bf7d1694641f6bb3289d980a2326183ad560f0,7f5cd5b1340ac06ea38bd05373c30136a6f4c1ca,8640a08cdb759d52da026f6d89521e36c61b5910,1597449a7f64b6bd24639b4deab96c8a8c184177,5d8b271c412f4be0c689bdfde93916efa0951deb,2d95c27d4ed8cfb8379164888cd79c6b239250b4,8dbab8de29b183d7589be8a568bca4b31902a54b,3323a47e69832301f8f434119b0346fc69708915,8cfb3412f1bd6025e14f4665c5723ed60a5d8061,8f7a7aea33c942e626832f014a831361b7fa39c7,a50f37cdd0614567ef52ffa63c70285d97630ce4,75c364909914f17791837ec88090262aa6656d3e,7ad94b0ec31d38b7915e88f743b573edb8efce5b,6fa2d1873bc12d1a698ec8d0e5e32e4236f3bd2b,2660dcf5bd16d14862a7bbb241fa4d85ae34327f,1bc34cb22131554ba18f6ba9e6ede5beb42939f1,bf69c98fca9a9f6c1cde871beddbcdc668b77771,69381b5efd97e7c55f51c2730caccab3d632d4d2,32c1e0f9ef6f1e337fe4aa2a4907314e5a3f4a5b,6eefbb79f98e902e9d2efa057bfea174843bf3dc,02a88547d6f6022bebc9aba6723a310cdf132f3f,391a5f286f814d852dddcab1b2b68e5c1af6c79e,fe44200fed05f9a7c656f2245deded8fd5f5e1e6,59a268ee97ba83c04abbe02769bd61dcd3747d25,ccca203382e5dd198c089a0f1d7af7bef0f694e9,91fc647899f801c9d351349ce73779918f90a713,6351590cf37eef826b89383fd8ccf8f1ab276559,61aec24ce3ce839bf08ce98e061099f2a20a50d6,b1706b4463701169d339c9c791cae0d4ec367b50,5bc511aa30f72720260d792e57537379fb04c395,cf4068a73d72ced9809a5e2462bb450bbbd47a64,94deb62af3054c49e7d80bd7eb3ed5efe990fc0b,ca0e479ba2327f71e842d033b6b48b082962cc6a,efca2a32ce9c7a808c2c3efcc2c3dac032dfc8ea,7a62457a9942e45429d4b5d9d8370210df3875ec,cc1e82125f7f8636b25ccdcdb63e8f812add7f87,243d553f1fc5b7ee8cfb6f49629f3a0a32b2c5c5,65499384f0947e223ec83f582366203e7aa64f1f,be88a24e9b6e26f10d4d84183c8f05ba33eb60c0,3527f43e8156d1bf5a0998405047c98036d172f0,046eb47d56beb8069b0098e3d01608f81ebb6849,0fbe5e2f2e2b8e2b2e2f0013e2e07cac2e5ce926,c48e0bd0f36c25ab83befbc7b7da369b75fd25f5,093e777e08d3a5474e225bbdb1a124d30434d416,247dec05283a1a521f99253a6cca6a5858cac0d2,ed9e7821b3e51c7e59183300d6c8cf90c8de0f26,e7c8fcbc24c73a576339e5f34f9f23f5ea732b3b,1fe201d9ec4d072c7af233d265927388f32d3ab3,70f7cd54b5918aed60c3d8c3a8e4aa7e8d634c41,7c70459d56214a7a3202732670f5ce726508eff6,da619a6c524f5ab800b44c8728db3cef3d3b25d9,1d174f0e3c391368d0f3384a144a6c7487f2a143,ce8a567f7578e8b6c9dc6510e2b058bd3a02019c,4d1fdd81f033cd58f3723bfc61e7d12079647a7a,da95d02a50b8208a17127987dde3cdf8da455114,e3b9ffde49c9b4a57b09a651187a2e194cb35693,6570ee5bd1656fddbdb030410a9d996739586067,689c7a86d973895a14feb984b8faa3d5581038ef,ba9b6f805feb62c978d384211f910790643a023e,521e5c337be51b8f8fdb858580bb46a0545ab1f9,aca6d5f3866372a4506cf15773ae298f18c3f453,b8aecf918f1c729eb2a2fa88da9eb16835daca5a,2742192c8d7248be8423e0333a9ab1c62c98bbbd,f117c6f12d067bd66dad40996b3931c069daa2da,6998e4ae3f1e037128bc57a56dd5d7707098e6bf,122a535ae02d4e0fa2512f9c3be77eae6a007266,eb8dba325534da472170293b054596a17558c7f2,e259ee075998eedc0b0c91c17769bf9dffeba46f,dbabab9bf5955558f73a37644f4bb626106a6d73,15748c0437c3be2e464dfb6aa42d2ff5dbd5d7f7,0026ea8a0fd31bdc959a4b9ed4d449f3015be8d1,dac7344737cb824634f757aede2dd46a6eed204b,0c7ae2c9e8c91edd6801f5578176b28e0a0414c6,bf5a42b53d156c0811e88e60d2a49f9fd9367cae,47bca586abefde3b796b65c986269f082fcb59c5,39af4070dca3221d275898c55884167bc03fe73d,6aca07154c111f1c8738347d7112cad6b0bf974a",21,"145772858.0,1950842.0,2144831836.0"
1a901533b09269bafa1222ad5f2f5eb0279915ac,Graph Information Bottleneck for Subgraph Recognition,given the input graph and its labelproperty several key problems of graph learning such as finding interpretable subgraphs graph denoising and graph compression can be attributed to the fundamental problem of recognizing a subgraph of the original one this subgraph shall be as informative as possible yet contains less redundant and noisy structure this problem setting is closely related to the wellknown information bottleneck ib principle which however has less been studied for the irregular graph data and graph neural networks gnns in this paper we propose a framework of graph information bottleneck gib for the subgraph recognition problem in deep graph learning under this framework one can recognize the maximally informative yet compressive subgraph named ibsubgraph however the gib objective is notoriously hard to optimize mostly due to the intractability of the mutual information of irregular graph data and the unstable optimization process in order to tackle these challenges we propose i a gib objective basedon a mutual information estimator for the irregular graph data ii a bilevel optimization scheme to maximize the gib objective iii a connectivity loss to stabilize the optimization process we evaluate the properties of the ibsubgraph in three application scenarios improvement of graph classification graph interpretation and graph denoising extensive experiments demonstrate that the informationtheoretic ibsubgraph enjoys superior graph properties,2020,90,2020-10-12,"Property Graph, Graph Modeling, Graph Neural Networks, Graph Querying, Interpretable Subgraphs, Graph Compression, Graph Neural Networks Gnns, Graph Information Bottleneck Gib, Deep Graph, Irregular Graph Data, Graph Classification Graph Interpretation, Extensive Experiments, Superior Graph Properties",International Conference on Learning Representations,"28822585,1754673,48537464,2419616,1768190,143712929","Junchi Yu,Tingyang Xu,Yu Rong,Yatao Bian,Junzhou Huang,R. He",28822585,"75fb60dee6641656fc4c1b663bb95d1aa91c6798,94deb62af3054c49e7d80bd7eb3ed5efe990fc0b,91fc647899f801c9d351349ce73779918f90a713,ba9b6f805feb62c978d384211f910790643a023e,1f9058eb0b639d0dffae192b3ffd5d80adabf0e9,4e13a8e8ba8d33e15ed037bfca7c651047533990,b080d072cfde697180db3234da08903c092e72c3,aca6d5f3866372a4506cf15773ae298f18c3f453,1597449a7f64b6bd24639b4deab96c8a8c184177,91d6e8ba5dd90b02fe3bd870b19da13a6167af53,6eb5744bd933dcd29ff4d79e340cf890272ef099,59a268ee97ba83c04abbe02769bd61dcd3747d25,659d8b24e53e8adfbcb1f16b26ada2cb8afa2c85,a8370aaa0ba9d69b7e83d5785c27b11be973cd84,5ccd1eefd94af0a20e10a0a5e0da22aa2f481c76,4d1fdd81f033cd58f3723bfc61e7d12079647a7a,6289d1271ff8176888d971bd8468dc5495b533f0,c24d47ff95cd4bda073c75ec24ececaa3b10c995,cc1e82125f7f8636b25ccdcdb63e8f812add7f87,9acd1892e2e299a30fa99f82bf60fc12cfa7aad3,de6cf3534f39748a223b9bb2b59d2e7ffcb6ae03,adf914b04914a9b856e26c575c789ba19f9f118d,7e631773b14d7203eb0d85742b2a850f51eb1616,b473e91cbe80c8b46451b49153cd5f93030480ab,bf69c98fca9a9f6c1cde871beddbcdc668b77771,15748c0437c3be2e464dfb6aa42d2ff5dbd5d7f7,752604994a7ca548ff2954114fc61a501d857b1c,d154d986c3a402c207c6c0e22093f2e1a878fe71,391a5f286f814d852dddcab1b2b68e5c1af6c79e,8b229216a36507730f9911433effab08c700195a,247dec05283a1a521f99253a6cca6a5858cac0d2,0a537eaf4444f0bd59f62a550430edab9d0a820d,7ad94b0ec31d38b7915e88f743b573edb8efce5b,07c4549be429a52274bc0ec083bf5598a3e5c365,2660dcf5bd16d14862a7bbb241fa4d85ae34327f,30acd43e62dbbdbe823bcc321ca1a1660ec7a622,02a88547d6f6022bebc9aba6723a310cdf132f3f,da95d02a50b8208a17127987dde3cdf8da455114,efca2a32ce9c7a808c2c3efcc2c3dac032dfc8ea,d63b884d5ebc739f6e1bdf861fa9276260781404,a5400a6f415d65aac1312edd2ca6b7361c241f85,ed9e7821b3e51c7e59183300d6c8cf90c8de0f26,cf4068a73d72ced9809a5e2462bb450bbbd47a64,f117c6f12d067bd66dad40996b3931c069daa2da,1c2de5fc71be2be3af28545e873605ead4d7d79b,80dd97954ddf3edd22d4cb21f0ac31b7ffed6bbf,9810bcaf5ac1792e6a2738a86f85ce270d448040,fe44200fed05f9a7c656f2245deded8fd5f5e1e6,7c70459d56214a7a3202732670f5ce726508eff6,bc6dbcaf4d2c76e618ae3f1043fd7276cbdf7f9b,e7c8fcbc24c73a576339e5f34f9f23f5ea732b3b,9c96a700a7abff857df936783f9e12a1ab38eee5,610063bfb7cb1e634f784ebe0799d0cb45f5480c,3dfa820702b6181c9964931f0a4d47fd298bf429,ecef432e7f6c9f431d5b34706a8de1fdebec46f9,ccca203382e5dd198c089a0f1d7af7bef0f694e9,3b217403302f9cb9d9685404c7646de7bc0db428,3a74bed911ccf213d9595b2b02a5b1c4ac4dcaf8,0026ea8a0fd31bdc959a4b9ed4d449f3015be8d1,63dc64fc2d23be98100f4c59e82278d838c78ef9,17fca92ffd527c78c5dc6c7953e96671743807fa,521e5c337be51b8f8fdb858580bb46a0545ab1f9,d427db1ba2cc92b36d16a5e5114f1027c90fff68,3527f43e8156d1bf5a0998405047c98036d172f0,b34fc78de28be598e21118d7cb9d84d63374addc,873b045dea18c2092b2c11e7b9542dd93ce84d65,d8b65198c37ada92cada81fe315508fc5bdbab8f,2742192c8d7248be8423e0333a9ab1c62c98bbbd,b15e942e526e4a03ecd0af31cbdf9b43bf81a829,1d174f0e3c391368d0f3384a144a6c7487f2a143,f47def30face829e8034a292c2e3e7a9f4240d34,e3d74f13374063a86909c7b0a8105be94902b7f4,6aca07154c111f1c8738347d7112cad6b0bf974a,09430c7080172d50a591cef44d85fd16e58d945e,c48e0bd0f36c25ab83befbc7b7da369b75fd25f5,1fe201d9ec4d072c7af233d265927388f32d3ab3,bc9fde639ceaceafe84c0ad94a2cd7badef141d3,57dcff5c3c15f6c5e5935ef7164c8f467a53848b,8894d431a768a35dc7ca4d762ebdba4f407b978c,16575f23ff879e6353a55bbfbbcc54e27606bfc5,933baeec555352784848a93284c9dd0e79477759,7b663c42dd72e2585eed4bf7fc41739e07ce9ff3,ce8a567f7578e8b6c9dc6510e2b058bd3a02019c,9e3816be8cf4821d74e258de10ee471382936a30,0a829289a16ae48837cc2905635435db98bacc76,ca5931b4c08eb96d40c65e1b9f8e4db46bf0585b,a4c5339f3f31c4a4406a1d82d3b0f3c63386166e,1f8a23697562b001082b147779b5eaefd3513d0a,b5aea8c6ebaab339b4e190decab80ab607815e8b,56092013ab20394725719910fc7d4fe2274f3d54",20,"1409970918.0,92015504.0,2080310633.0"
15748c0437c3be2e464dfb6aa42d2ff5dbd5d7f7,Understanding the Representation Power of Graph Neural Networks in Learning Graph Topology,to deepen our understanding of graph neural networks we investigate the representation power of graph convolutional networks gcn through the looking glass of graph moments a key property of graph topology encoding path of various lengths we find that gcns are rather restrictive in learning graph moments without careful design gcns can fail miserably even with multiple layers and nonlinear activation functions we analyze theoretically the expressiveness of gcns arriving at a modular gcn design using different propagation rules our modular design is capable of distinguishing graphs from different graph generation models for surprisingly small graphs a notoriously difficult problem in network science our investigation suggests that depth is much more influential than width with deeper gcns being more capable of learning higher order graph moments additionally combining gcn modules with different propagation rules is critical to the representation power of gcns,2019,110,2019-07-11,"Property Graph, Property Graph Schema, Graph Analytics, Graph Storage, Graph Neural Networks, Graph Convolutional Networks, Graph Topology Encoding Path, Graph Moments, Careful Design Gcns, Different Graph Generation Models, Surprisingly Small Graphs, Network Science, Deeper Gcns, Higher Order Graph Moments, Gcn Modules, Different Propagation Rules",Neural Information Processing Systems,"9716460,1745069,2023052","Nima Dehmamy,A. Barabási,Rose Yu",9716460,"243d553f1fc5b7ee8cfb6f49629f3a0a32b2c5c5,b8aecf918f1c729eb2a2fa88da9eb16835daca5a,8dbab8de29b183d7589be8a568bca4b31902a54b,a8370aaa0ba9d69b7e83d5785c27b11be973cd84,91fc647899f801c9d351349ce73779918f90a713,d154d986c3a402c207c6c0e22093f2e1a878fe71,02a88547d6f6022bebc9aba6723a310cdf132f3f,2660dcf5bd16d14862a7bbb241fa4d85ae34327f,a5400a6f415d65aac1312edd2ca6b7361c241f85,7c70459d56214a7a3202732670f5ce726508eff6,32c1e0f9ef6f1e337fe4aa2a4907314e5a3f4a5b,e3d74f13374063a86909c7b0a8105be94902b7f4,ce8a567f7578e8b6c9dc6510e2b058bd3a02019c,6eb5744bd933dcd29ff4d79e340cf890272ef099,39af4070dca3221d275898c55884167bc03fe73d,44842bba66366522de782f537d9bc61d8868bf08,65499384f0947e223ec83f582366203e7aa64f1f,00d681cfff7f0224ace607e515f4ed510e792df9,d8b65198c37ada92cada81fe315508fc5bdbab8f,bf5a42b53d156c0811e88e60d2a49f9fd9367cae,1e4709c0b8fe3bf759cd64dc1ede695d6e5316f0,e7c8fcbc24c73a576339e5f34f9f23f5ea732b3b,bc9fde639ceaceafe84c0ad94a2cd7badef141d3,8e6d0ed32aaa5e3d7c598d5a2ace76eab8485801,3b217403302f9cb9d9685404c7646de7bc0db428,75fb60dee6641656fc4c1b663bb95d1aa91c6798,efca2a32ce9c7a808c2c3efcc2c3dac032dfc8ea,57dcff5c3c15f6c5e5935ef7164c8f467a53848b,59f1df2f60280eea79d195b9c561d52a77fb24de,4e13a8e8ba8d33e15ed037bfca7c651047533990,bc6dbcaf4d2c76e618ae3f1043fd7276cbdf7f9b,1d174f0e3c391368d0f3384a144a6c7487f2a143,752604994a7ca548ff2954114fc61a501d857b1c,db9967871249ffd77adc0c0cc16154ccc37d09ad,093e777e08d3a5474e225bbdb1a124d30434d416,07627bf7eb649220ffbcdf6bf233e3a4a76e8590,0c7ae2c9e8c91edd6801f5578176b28e0a0414c6,d65d64c3f6ea322d9e85138fe5c8e85acbf661e3,5bc511aa30f72720260d792e57537379fb04c395,247dec05283a1a521f99253a6cca6a5858cac0d2,9e3816be8cf4821d74e258de10ee471382936a30,1597449a7f64b6bd24639b4deab96c8a8c184177,de6cf3534f39748a223b9bb2b59d2e7ffcb6ae03,dac7344737cb824634f757aede2dd46a6eed204b,59a268ee97ba83c04abbe02769bd61dcd3747d25,91b63db746becca15090963a8990dfe2b5103799,3a74bed911ccf213d9595b2b02a5b1c4ac4dcaf8,3527f43e8156d1bf5a0998405047c98036d172f0,391a5f286f814d852dddcab1b2b68e5c1af6c79e,0ff76855604fc150ecd36bc8c3197780a8ea2b23,dba7c73503c4b7abad96aaa4a167fd7e701c4059,16575f23ff879e6353a55bbfbbcc54e27606bfc5,bfdc1a7d5aab0f4bce4afc9723192937c24ef5ff,1c2de5fc71be2be3af28545e873605ead4d7d79b,80dd97954ddf3edd22d4cb21f0ac31b7ffed6bbf,c48e0bd0f36c25ab83befbc7b7da369b75fd25f5,0a537eaf4444f0bd59f62a550430edab9d0a820d,6aca07154c111f1c8738347d7112cad6b0bf974a,6fa2d1873bc12d1a698ec8d0e5e32e4236f3bd2b,5ccd1eefd94af0a20e10a0a5e0da22aa2f481c76,07c4549be429a52274bc0ec083bf5598a3e5c365,30bf7d1694641f6bb3289d980a2326183ad560f0,d427db1ba2cc92b36d16a5e5114f1027c90fff68,5d8b271c412f4be0c689bdfde93916efa0951deb,adf914b04914a9b856e26c575c789ba19f9f118d,1bc34cb22131554ba18f6ba9e6ede5beb42939f1,dbabab9bf5955558f73a37644f4bb626106a6d73,8640a08cdb759d52da026f6d89521e36c61b5910,4e6bba65f7636a655c778a3e54cc58e148468963,bf69c98fca9a9f6c1cde871beddbcdc668b77771,70f7cd54b5918aed60c3d8c3a8e4aa7e8d634c41,b1706b4463701169d339c9c791cae0d4ec367b50,521e5c337be51b8f8fdb858580bb46a0545ab1f9,b15e942e526e4a03ecd0af31cbdf9b43bf81a829,42fe18be6e9ff2c11e5b2347c93e131c9abc7a51,7a62457a9942e45429d4b5d9d8370210df3875ec,b473e91cbe80c8b46451b49153cd5f93030480ab,82181d5c33590a81ab3b773c3948141eb22d89fb,09430c7080172d50a591cef44d85fd16e58d945e,be88a24e9b6e26f10d4d84183c8f05ba33eb60c0,bcad76ae5cea05bad85fd6b2b08aa30a801d9a3b,0534fc2dd13c781f02df2931d651fd39d03b8355,da95d02a50b8208a17127987dde3cdf8da455114,8f7a7aea33c942e626832f014a831361b7fa39c7,6998e4ae3f1e037128bc57a56dd5d7707098e6bf,94deb62af3054c49e7d80bd7eb3ed5efe990fc0b,69381b5efd97e7c55f51c2730caccab3d632d4d2,610063bfb7cb1e634f784ebe0799d0cb45f5480c,fa9645e0491164fe78890073548284604958f383,61aec24ce3ce839bf08ce98e061099f2a20a50d6,4d1fdd81f033cd58f3723bfc61e7d12079647a7a,ecef432e7f6c9f431d5b34706a8de1fdebec46f9,0fbe5e2f2e2b8e2b2e2f0013e2e07cac2e5ce926,d9f836a2062864e4808e12224e2286a353498202,0a829289a16ae48837cc2905635435db98bacc76,17fca92ffd527c78c5dc6c7953e96671743807fa,cf4068a73d72ced9809a5e2462bb450bbbd47a64,b31ce19f12bbf6058f4fe849d9f3654932353f20,9acd1892e2e299a30fa99f82bf60fc12cfa7aad3,a4c5339f3f31c4a4406a1d82d3b0f3c63386166e,d71c0365685300539109e0fd07e34c9dd9beff75,1f9058eb0b639d0dffae192b3ffd5d80adabf0e9,3bc9bb1f2218dcbd15c3b7cdfcb43077a3f30779,e3b9ffde49c9b4a57b09a651187a2e194cb35693,2742192c8d7248be8423e0333a9ab1c62c98bbbd,da619a6c524f5ab800b44c8728db3cef3d3b25d9,f117c6f12d067bd66dad40996b3931c069daa2da,933baeec555352784848a93284c9dd0e79477759,122a535ae02d4e0fa2512f9c3be77eae6a007266,7ad94b0ec31d38b7915e88f743b573edb8efce5b",19,"49500220.0,14140001.0,144186679.0"
5d8b271c412f4be0c689bdfde93916efa0951deb,Molecular Property Prediction: A Multilevel Quantum Interactions Modeling Perspective,predicting molecular properties eg atomization energy is an essential issue in quantum chemistry which could speed up much research progress such as drug designing and substance discovery traditional studies based on density functional theory dft in physics are proved to be timeconsuming for predicting large number of molecules recently the machine learning methods which consider much rulebased information have also shown potentials for this issue however the complex inherent quantum interactions of molecules are still largely underexplored by existing solutions in this paper we propose a generalizable and transferable multilevel graph convolutional neural network mgcn for molecular property prediction specifically we represent each molecule as a graph to preserve its internal structure moreover the welldesigned hierarchical graph neural network directly extracts features from the conformation and spatial information followed by the multilevel interactions as a consequence the multilevel overall representations can be utilized to make the prediction extensive experiments on both datasets of equilibrium and offequilibrium molecules demonstrate the effectiveness of our model furthermore the detailed results also prove that mgcn is generalizable and transferable for the prediction,2019,73,2019-06-25,"Property Graph, Graph Embeddings, Graph Visualization, Graph Algorithms, Molecular Properties, Quantum Chemistry, Density Functional Theory Dft, Large Number, Existing Solutions, Molecular Property Prediction, Spatial Information",AAAI Conference on Artificial Intelligence,"46655401,50384136,2144447281,3374015,103155734,47648651","Chengqiang Lu,Qi Liu,Chao Wang,Zhenya Huang,Peize Lin,Lixin He",46655401,"bcad76ae5cea05bad85fd6b2b08aa30a801d9a3b,f117c6f12d067bd66dad40996b3931c069daa2da,1c2de5fc71be2be3af28545e873605ead4d7d79b,59f1df2f60280eea79d195b9c561d52a77fb24de,c48e0bd0f36c25ab83befbc7b7da369b75fd25f5,59a268ee97ba83c04abbe02769bd61dcd3747d25,7c70459d56214a7a3202732670f5ce726508eff6,7ad94b0ec31d38b7915e88f743b573edb8efce5b,b1706b4463701169d339c9c791cae0d4ec367b50,752604994a7ca548ff2954114fc61a501d857b1c,69381b5efd97e7c55f51c2730caccab3d632d4d2,adf914b04914a9b856e26c575c789ba19f9f118d,6aca07154c111f1c8738347d7112cad6b0bf974a,9e3816be8cf4821d74e258de10ee471382936a30,61aec24ce3ce839bf08ce98e061099f2a20a50d6,efca2a32ce9c7a808c2c3efcc2c3dac032dfc8ea,39af4070dca3221d275898c55884167bc03fe73d,28816b148281af9ba41469b4c69dd69c2afd2b95,cf4068a73d72ced9809a5e2462bb450bbbd47a64,ecef432e7f6c9f431d5b34706a8de1fdebec46f9,02a88547d6f6022bebc9aba6723a310cdf132f3f,b8aecf918f1c729eb2a2fa88da9eb16835daca5a,5bc511aa30f72720260d792e57537379fb04c395,b473e91cbe80c8b46451b49153cd5f93030480ab,933baeec555352784848a93284c9dd0e79477759,8f7a7aea33c942e626832f014a831361b7fa39c7,e3b9ffde49c9b4a57b09a651187a2e194cb35693,be88a24e9b6e26f10d4d84183c8f05ba33eb60c0,0fbe5e2f2e2b8e2b2e2f0013e2e07cac2e5ce926,3a74bed911ccf213d9595b2b02a5b1c4ac4dcaf8,82181d5c33590a81ab3b773c3948141eb22d89fb,093e777e08d3a5474e225bbdb1a124d30434d416,122a535ae02d4e0fa2512f9c3be77eae6a007266,4e13a8e8ba8d33e15ed037bfca7c651047533990,b15e942e526e4a03ecd0af31cbdf9b43bf81a829,8640a08cdb759d52da026f6d89521e36c61b5910,9acd1892e2e299a30fa99f82bf60fc12cfa7aad3,e3d74f13374063a86909c7b0a8105be94902b7f4,16575f23ff879e6353a55bbfbbcc54e27606bfc5,3bc9bb1f2218dcbd15c3b7cdfcb43077a3f30779,0ff76855604fc150ecd36bc8c3197780a8ea2b23,243d553f1fc5b7ee8cfb6f49629f3a0a32b2c5c5,dba7c73503c4b7abad96aaa4a167fd7e701c4059,bc9fde639ceaceafe84c0ad94a2cd7badef141d3,bf5a42b53d156c0811e88e60d2a49f9fd9367cae,57dcff5c3c15f6c5e5935ef7164c8f467a53848b,bc6dbcaf4d2c76e618ae3f1043fd7276cbdf7f9b,6fa2d1873bc12d1a698ec8d0e5e32e4236f3bd2b,1f9058eb0b639d0dffae192b3ffd5d80adabf0e9,91fc647899f801c9d351349ce73779918f90a713,da619a6c524f5ab800b44c8728db3cef3d3b25d9,91d6e8ba5dd90b02fe3bd870b19da13a6167af53,f47def30face829e8034a292c2e3e7a9f4240d34,d427db1ba2cc92b36d16a5e5114f1027c90fff68,dac7344737cb824634f757aede2dd46a6eed204b,7a62457a9942e45429d4b5d9d8370210df3875ec,b31ce19f12bbf6058f4fe849d9f3654932353f20,75fb60dee6641656fc4c1b663bb95d1aa91c6798,ce8a567f7578e8b6c9dc6510e2b058bd3a02019c,dbabab9bf5955558f73a37644f4bb626106a6d73,4d1fdd81f033cd58f3723bfc61e7d12079647a7a,d8b65198c37ada92cada81fe315508fc5bdbab8f,a8370aaa0ba9d69b7e83d5785c27b11be973cd84,391a5f286f814d852dddcab1b2b68e5c1af6c79e,a4c5339f3f31c4a4406a1d82d3b0f3c63386166e,0a537eaf4444f0bd59f62a550430edab9d0a820d,94deb62af3054c49e7d80bd7eb3ed5efe990fc0b,8cfb3412f1bd6025e14f4665c5723ed60a5d8061,1597449a7f64b6bd24639b4deab96c8a8c184177,44842bba66366522de782f537d9bc61d8868bf08,1e4709c0b8fe3bf759cd64dc1ede695d6e5316f0,8dbab8de29b183d7589be8a568bca4b31902a54b,d154d986c3a402c207c6c0e22093f2e1a878fe71",19,"38767143.0,48902343.0,1901688087.0"
07c4549be429a52274bc0ec083bf5598a3e5c365,Modeling and Discovering Vulnerabilities with Code Property Graphs,the vast majority of security breaches encountered today are a direct result of insecure code consequently the protection of computer systems critically depends on the rigorous identification of vulnerabilities in software a tedious and errorprone process requiring significant expertise unfortunately a single flaw suffices to undermine the security of a system and thus the sheer amount of code to audit plays into the attackers cards in this paper we present a method to effectively mine large amounts of source code for vulnerabilities to this end we introduce a novel representation of source code called a code property graph that merges concepts of classic program analysis namely abstract syntax trees control flow graphs and program dependence graphs into a joint data structure this comprehensive representation enables us to elegantly model templates for common vulnerabilities with graph traversals that for instance can identify buffer overflows integer overflows format string vulnerabilities or memory disclosures we implement our approach using a popular graph database and demonstrate its efficacy by identifying  previously unknown vulnerabilities in the source code of the linux kernel,2014,18,2014-05-18,"Property Graph, Graph Storage, Graph Similarity, Graph Database, Security Breaches, Insecure Code, Computer Systems, Significant Expertise, Large Amounts, Source Code, Classic Program Analysis, Program Dependence Graphs, Common Vulnerabilities, Graph Traversals, Format String Vulnerabilities, Memory Disclosures, Previously Unknown Vulnerabilities",IEEE Symposium on Security and Privacy,"2944486,2641234,79405068,144825749","Fabian Yamaguchi,N. Golde,Dan Arp,Konrad Rieck",2944486,"db9967871249ffd77adc0c0cc16154ccc37d09ad,0fbe5e2f2e2b8e2b2e2f0013e2e07cac2e5ce926,bf5a42b53d156c0811e88e60d2a49f9fd9367cae,4e6bba65f7636a655c778a3e54cc58e148468963,da619a6c524f5ab800b44c8728db3cef3d3b25d9,5ccd1eefd94af0a20e10a0a5e0da22aa2f481c76,dac7344737cb824634f757aede2dd46a6eed204b,59a268ee97ba83c04abbe02769bd61dcd3747d25,dba7c73503c4b7abad96aaa4a167fd7e701c4059,69381b5efd97e7c55f51c2730caccab3d632d4d2,e3b9ffde49c9b4a57b09a651187a2e194cb35693,f117c6f12d067bd66dad40996b3931c069daa2da,7a62457a9942e45429d4b5d9d8370210df3875ec,00d681cfff7f0224ace607e515f4ed510e792df9,ce8a567f7578e8b6c9dc6510e2b058bd3a02019c,b31ce19f12bbf6058f4fe849d9f3654932353f20,91b63db746becca15090963a8990dfe2b5103799,8cfb3412f1bd6025e14f4665c5723ed60a5d8061",14,"38929912.0,39714312.0,14140001.0"
