paperId,title,abstract,year,citationCount,publicationDate,keywords,jcwName,authorId,authorName,correspondingAuthorId,citedPaperId,edition,reviewers
610063bfb7cb1e634f784ebe0799d0cb45f5480c,A Property Testing Framework for the Theoretical Expressivity of Graph Kernels,graph kernels are applied heavily for the classification of structured data however their expressivity is assessed almost exclusively from experimental studies and there is no theoretical justification why one kernel is in general preferable over another we introduce a theoretical framework for investigating the expressive power of graph kernels which is inspired by concepts from the area of property testing we introduce the notion of distinguishability of a graph property by a graph kernel for several established graph kernels we show that they cannot distinguish essential graph properties in order to overcome this we consider a kernel based on kdisc frequencies we show that this efficiently computable kernel can distinguish fundamental graph properties finally we obtain learning guarantees for nearest neighbor classifiers in our framework,2018,30,2018-07-01,"Property Graph, Graph Clustering, Graph Representation Learning, Graph-Based Recommendation, Graph Kernels, Structured Data, Experimental Studies, Property Testing, Essential Graph Properties, Kdisc Frequencies, Fundamental Graph Properties, Nearest Neighbor Classifiers",International Joint Conference on Artificial Intelligence,"1810077,143622465,39352108,1701715","Nils M. Kriege,Christopher Morris,Anja Rey,C. Sohler",1810077,"933baeec555352784848a93284c9dd0e79477759,42fe18be6e9ff2c11e5b2347c93e131c9abc7a51,1d174f0e3c391368d0f3384a144a6c7487f2a143,752604994a7ca548ff2954114fc61a501d857b1c,e7c8fcbc24c73a576339e5f34f9f23f5ea732b3b,4d044f0c84be360b26398b58027e618d5f08a83f,30bf7d1694641f6bb3289d980a2326183ad560f0,bc9fde639ceaceafe84c0ad94a2cd7badef141d3,7a62457a9942e45429d4b5d9d8370210df3875ec,4d1fdd81f033cd58f3723bfc61e7d12079647a7a,94deb62af3054c49e7d80bd7eb3ed5efe990fc0b,093e777e08d3a5474e225bbdb1a124d30434d416,b1706b4463701169d339c9c791cae0d4ec367b50,4e6bba65f7636a655c778a3e54cc58e148468963,8cfb3412f1bd6025e14f4665c5723ed60a5d8061,1c2de5fc71be2be3af28545e873605ead4d7d79b,bcad76ae5cea05bad85fd6b2b08aa30a801d9a3b,dba7c73503c4b7abad96aaa4a167fd7e701c4059,3a74bed911ccf213d9595b2b02a5b1c4ac4dcaf8,cf4068a73d72ced9809a5e2462bb450bbbd47a64,09430c7080172d50a591cef44d85fd16e58d945e,80dd97954ddf3edd22d4cb21f0ac31b7ffed6bbf,f117c6f12d067bd66dad40996b3931c069daa2da,2742192c8d7248be8423e0333a9ab1c62c98bbbd,dac7344737cb824634f757aede2dd46a6eed204b,61aec24ce3ce839bf08ce98e061099f2a20a50d6,d71c0365685300539109e0fd07e34c9dd9beff75,adf914b04914a9b856e26c575c789ba19f9f118d,d427db1ba2cc92b36d16a5e5114f1027c90fff68,8f7a7aea33c942e626832f014a831361b7fa39c7",18,"2269971203,144019071,2201329"
d9f836a2062864e4808e12224e2286a353498202,Graph Convolutional Policy Network for Goal-Directed Molecular Graph Generation,generating novel graph structures that optimize given objectives while obeying some given underlying rules is fundamental for chemistry biology and social science research this is especially important in the task of molecular graph generation whose goal is to discover novel molecules with desired properties such as druglikeness and synthetic accessibility while obeying physical laws such as chemical valency however designing models to find molecules that optimize desired properties while incorporating highly complex and nondifferentiable rules remains to be a challenging task here we propose graph convolutional policy network gcpn a general graph convolutional network based model for goaldirected graph generation through reinforcement learning the model is trained to optimize domainspecific rewards and adversarial loss through policy gradient and acts in an environment that incorporates domainspecific rules experimental results show that gcpn can achieve  improvement on chemical property optimization over stateoftheart baselines while resembling known molecules and achieve  improvement on the constrained property optimization task,2018,76,2018-06-07,"Property Graph, Graph Modeling, Graph Embeddings, Graph Pattern Matching, Underlying Rules, Chemistry Biology, Social Science Research, Molecular Graph Generation, Novel Molecules, Desired Properties, Synthetic Accessibility, Physical Laws, Chemical Valency, Graph Convolutional Policy Network, Goaldirected Graph Generation, Domainspecific Rewards, Adversarial Loss, Policy Gradient, Domainspecific Rules, Experimental Results, Chemical Property Optimization, Stateoftheart Baselines, Known Molecules",Neural Information Processing Systems,"145829303,2156641189,83539859,1806271,1702139","Jiaxuan You,Bowen Liu,Rex Ying,V. Pande,J. Leskovec",145829303,"c48e0bd0f36c25ab83befbc7b7da369b75fd25f5,bf5a42b53d156c0811e88e60d2a49f9fd9367cae,3b217403302f9cb9d9685404c7646de7bc0db428,61aec24ce3ce839bf08ce98e061099f2a20a50d6,16575f23ff879e6353a55bbfbbcc54e27606bfc5,ce8a567f7578e8b6c9dc6510e2b058bd3a02019c,09430c7080172d50a591cef44d85fd16e58d945e,00d681cfff7f0224ace607e515f4ed510e792df9,6fa2d1873bc12d1a698ec8d0e5e32e4236f3bd2b,7c70459d56214a7a3202732670f5ce726508eff6,4e6bba65f7636a655c778a3e54cc58e148468963,1d174f0e3c391368d0f3384a144a6c7487f2a143,5ccd1eefd94af0a20e10a0a5e0da22aa2f481c76,dac7344737cb824634f757aede2dd46a6eed204b,d427db1ba2cc92b36d16a5e5114f1027c90fff68,7a62457a9942e45429d4b5d9d8370210df3875ec,2660dcf5bd16d14862a7bbb241fa4d85ae34327f,7ad94b0ec31d38b7915e88f743b573edb8efce5b,cf4068a73d72ced9809a5e2462bb450bbbd47a64,de6cf3534f39748a223b9bb2b59d2e7ffcb6ae03,1e4709c0b8fe3bf759cd64dc1ede695d6e5316f0,bf69c98fca9a9f6c1cde871beddbcdc668b77771,4d1fdd81f033cd58f3723bfc61e7d12079647a7a,093e777e08d3a5474e225bbdb1a124d30434d416,3a74bed911ccf213d9595b2b02a5b1c4ac4dcaf8,30bf7d1694641f6bb3289d980a2326183ad560f0,da619a6c524f5ab800b44c8728db3cef3d3b25d9,4d044f0c84be360b26398b58027e618d5f08a83f,752604994a7ca548ff2954114fc61a501d857b1c,1c2de5fc71be2be3af28545e873605ead4d7d79b,28816b148281af9ba41469b4c69dd69c2afd2b95,adf914b04914a9b856e26c575c789ba19f9f118d,0fbe5e2f2e2b8e2b2e2f0013e2e07cac2e5ce926,80dd97954ddf3edd22d4cb21f0ac31b7ffed6bbf,91b63db746becca15090963a8990dfe2b5103799,b473e91cbe80c8b46451b49153cd5f93030480ab,391a5f286f814d852dddcab1b2b68e5c1af6c79e,f47def30face829e8034a292c2e3e7a9f4240d34,b31ce19f12bbf6058f4fe849d9f3654932353f20,1bc34cb22131554ba18f6ba9e6ede5beb42939f1,42fe18be6e9ff2c11e5b2347c93e131c9abc7a51,dba7c73503c4b7abad96aaa4a167fd7e701c4059,d63b884d5ebc739f6e1bdf861fa9276260781404,bc9fde639ceaceafe84c0ad94a2cd7badef141d3,02a88547d6f6022bebc9aba6723a310cdf132f3f,07627bf7eb649220ffbcdf6bf233e3a4a76e8590,b8aecf918f1c729eb2a2fa88da9eb16835daca5a,32c1e0f9ef6f1e337fe4aa2a4907314e5a3f4a5b,59a268ee97ba83c04abbe02769bd61dcd3747d25,b15e942e526e4a03ecd0af31cbdf9b43bf81a829,8f7a7aea33c942e626832f014a831361b7fa39c7,d65d64c3f6ea322d9e85138fe5c8e85acbf661e3,a8370aaa0ba9d69b7e83d5785c27b11be973cd84,fa9645e0491164fe78890073548284604958f383,bcad76ae5cea05bad85fd6b2b08aa30a801d9a3b,1f9058eb0b639d0dffae192b3ffd5d80adabf0e9,07c4549be429a52274bc0ec083bf5598a3e5c365,e7c8fcbc24c73a576339e5f34f9f23f5ea732b3b,a5400a6f415d65aac1312edd2ca6b7361c241f85,be88a24e9b6e26f10d4d84183c8f05ba33eb60c0,59f1df2f60280eea79d195b9c561d52a77fb24de,91d6e8ba5dd90b02fe3bd870b19da13a6167af53,8cfb3412f1bd6025e14f4665c5723ed60a5d8061,6998e4ae3f1e037128bc57a56dd5d7707098e6bf,d71c0365685300539109e0fd07e34c9dd9beff75,94deb62af3054c49e7d80bd7eb3ed5efe990fc0b,3527f43e8156d1bf5a0998405047c98036d172f0,db9967871249ffd77adc0c0cc16154ccc37d09ad,1597449a7f64b6bd24639b4deab96c8a8c184177,933baeec555352784848a93284c9dd0e79477759,e3b9ffde49c9b4a57b09a651187a2e194cb35693,f117c6f12d067bd66dad40996b3931c069daa2da,2742192c8d7248be8423e0333a9ab1c62c98bbbd,82181d5c33590a81ab3b773c3948141eb22d89fb,69381b5efd97e7c55f51c2730caccab3d632d4d2,efca2a32ce9c7a808c2c3efcc2c3dac032dfc8ea",18,"2115252929,145153297,13290587"
3323a47e69832301f8f434119b0346fc69708915,GraphDF: A Discrete Flow Model for Molecular Graph Generation,we consider the problem of molecular graph generation using deep models while graphs are discrete most existing methods use continuous latent variables resulting in inaccurate modeling of discrete graph structures in this work we propose graphdf a novel discrete latent variable model for molecular graph generation based on normalizing flow methods graphdf uses invertible modulo shift transforms to map discrete latent variables to graph nodes and edges we show that the use of discrete latent variables reduces computational costs and eliminates the negative effect of dequantization comprehensive experimental results show that graphdf outperforms prior methods on random generation property optimization and constrained optimization tasks,2021,116,2021-02-02,"Property Graph, Graph Modeling, Graph Representation Learning, Property Graph Schema, Molecular Graph Generation, Deep Models, Continuous Latent Variables, Inaccurate Modeling, Discrete Graph Structures, Normalizing Flow Methods, Invertible Modulo Shift, Discrete Latent Variables, Graph Nodes, Computational Costs, Dequantization Comprehensive Experimental Results, Prior Methods, Random Generation Property Optimization, Constrained Optimization Tasks",International Conference on Machine Learning,"2004524780,1879114760,1743600","Youzhi Luo,Keqiang Yan,Shuiwang Ji",2004524780,"6289d1271ff8176888d971bd8468dc5495b533f0,30acd43e62dbbdbe823bcc321ca1a1660ec7a622,c24d47ff95cd4bda073c75ec24ececaa3b10c995,de6cf3534f39748a223b9bb2b59d2e7ffcb6ae03,47bca586abefde3b796b65c986269f082fcb59c5,b1706b4463701169d339c9c791cae0d4ec367b50,2742192c8d7248be8423e0333a9ab1c62c98bbbd,08257eb1faa19c29ddcc31d7d749c9bd262213c5,e3b9ffde49c9b4a57b09a651187a2e194cb35693,0fbe5e2f2e2b8e2b2e2f0013e2e07cac2e5ce926,8640a08cdb759d52da026f6d89521e36c61b5910,243d553f1fc5b7ee8cfb6f49629f3a0a32b2c5c5,456c011594ecacdd24298a161787389ccbe4b88b,ba9b6f805feb62c978d384211f910790643a023e,b6b7fea1846e85ac1e3c7e3adda6e65b127d0368,6351590cf37eef826b89383fd8ccf8f1ab276559,ecef432e7f6c9f431d5b34706a8de1fdebec46f9,9acd1892e2e299a30fa99f82bf60fc12cfa7aad3,5bc511aa30f72720260d792e57537379fb04c395,6fa2d1873bc12d1a698ec8d0e5e32e4236f3bd2b,3527f43e8156d1bf5a0998405047c98036d172f0,75c364909914f17791837ec88090262aa6656d3e,61aec24ce3ce839bf08ce98e061099f2a20a50d6,bcad76ae5cea05bad85fd6b2b08aa30a801d9a3b,75fb60dee6641656fc4c1b663bb95d1aa91c6798,659d8b24e53e8adfbcb1f16b26ada2cb8afa2c85,00d681cfff7f0224ace607e515f4ed510e792df9,30bf7d1694641f6bb3289d980a2326183ad560f0,57dcff5c3c15f6c5e5935ef7164c8f467a53848b,59a268ee97ba83c04abbe02769bd61dcd3747d25,0534fc2dd13c781f02df2931d651fd39d03b8355,07c4549be429a52274bc0ec083bf5598a3e5c365,7f5cd5b1340ac06ea38bd05373c30136a6f4c1ca,718b5a40dba91bfa0bdfb9ac9ca4381425d2ff95,ccca203382e5dd198c089a0f1d7af7bef0f694e9,59f1df2f60280eea79d195b9c561d52a77fb24de,5d8b271c412f4be0c689bdfde93916efa0951deb,3b217403302f9cb9d9685404c7646de7bc0db428,d8b65198c37ada92cada81fe315508fc5bdbab8f,3789eb72c32ecf5e33442570358dd786dd67c8a2,a5400a6f415d65aac1312edd2ca6b7361c241f85,78e40584f0d149bf6f98beb5561b7b83cb68e1b1,d427db1ba2cc92b36d16a5e5114f1027c90fff68,4e6bba65f7636a655c778a3e54cc58e148468963,1f8a23697562b001082b147779b5eaefd3513d0a,9c96a700a7abff857df936783f9e12a1ab38eee5,8e6d0ed32aaa5e3d7c598d5a2ace76eab8485801,d71c0365685300539109e0fd07e34c9dd9beff75,0608fc7e1825c4ac1f61aaa95b67f155d93b0ea4,9e3816be8cf4821d74e258de10ee471382936a30,0ebd0ad7fbedde936390eeac6aed1356876cbeff,1d174f0e3c391368d0f3384a144a6c7487f2a143,16575f23ff879e6353a55bbfbbcc54e27606bfc5,0026ea8a0fd31bdc959a4b9ed4d449f3015be8d1,a0d18dddaa995b126ad373e33767b9b881d16b2f,da619a6c524f5ab800b44c8728db3cef3d3b25d9,09430c7080172d50a591cef44d85fd16e58d945e,cc1e82125f7f8636b25ccdcdb63e8f812add7f87,3a74bed911ccf213d9595b2b02a5b1c4ac4dcaf8,4d044f0c84be360b26398b58027e618d5f08a83f,1a901533b09269bafa1222ad5f2f5eb0279915ac,b473e91cbe80c8b46451b49153cd5f93030480ab,1e4709c0b8fe3bf759cd64dc1ede695d6e5316f0,7c70459d56214a7a3202732670f5ce726508eff6,046eb47d56beb8069b0098e3d01608f81ebb6849,7a62457a9942e45429d4b5d9d8370210df3875ec,ed9e7821b3e51c7e59183300d6c8cf90c8de0f26,dbabab9bf5955558f73a37644f4bb626106a6d73,521e5c337be51b8f8fdb858580bb46a0545ab1f9,e7c8fcbc24c73a576339e5f34f9f23f5ea732b3b,bf69c98fca9a9f6c1cde871beddbcdc668b77771,0a537eaf4444f0bd59f62a550430edab9d0a820d,1597449a7f64b6bd24639b4deab96c8a8c184177,dba7c73503c4b7abad96aaa4a167fd7e701c4059,b8aecf918f1c729eb2a2fa88da9eb16835daca5a,fa9645e0491164fe78890073548284604958f383,80dd97954ddf3edd22d4cb21f0ac31b7ffed6bbf,2660dcf5bd16d14862a7bbb241fa4d85ae34327f,cf4068a73d72ced9809a5e2462bb450bbbd47a64,65499384f0947e223ec83f582366203e7aa64f1f,b15e942e526e4a03ecd0af31cbdf9b43bf81a829,42fe18be6e9ff2c11e5b2347c93e131c9abc7a51,391a5f286f814d852dddcab1b2b68e5c1af6c79e,093e777e08d3a5474e225bbdb1a124d30434d416,4e13a8e8ba8d33e15ed037bfca7c651047533990,39af4070dca3221d275898c55884167bc03fe73d,d154d986c3a402c207c6c0e22093f2e1a878fe71,d65d64c3f6ea322d9e85138fe5c8e85acbf661e3,5ccd1eefd94af0a20e10a0a5e0da22aa2f481c76,adf914b04914a9b856e26c575c789ba19f9f118d,a8370aaa0ba9d69b7e83d5785c27b11be973cd84,c7e10109fed73e523bf2a78b00e4b657004d41fc,91b63db746becca15090963a8990dfe2b5103799,ce8a567f7578e8b6c9dc6510e2b058bd3a02019c,69381b5efd97e7c55f51c2730caccab3d632d4d2,c48e0bd0f36c25ab83befbc7b7da369b75fd25f5,bc9fde639ceaceafe84c0ad94a2cd7badef141d3,d63b884d5ebc739f6e1bdf861fa9276260781404,9810bcaf5ac1792e6a2738a86f85ce270d448040,bc6dbcaf4d2c76e618ae3f1043fd7276cbdf7f9b,8dbab8de29b183d7589be8a568bca4b31902a54b,dac7344737cb824634f757aede2dd46a6eed204b,94deb62af3054c49e7d80bd7eb3ed5efe990fc0b,ca5931b4c08eb96d40c65e1b9f8e4db46bf0585b,0ff76855604fc150ecd36bc8c3197780a8ea2b23,6eefbb79f98e902e9d2efa057bfea174843bf3dc,91fc647899f801c9d351349ce73779918f90a713,b5aea8c6ebaab339b4e190decab80ab607815e8b,fe44200fed05f9a7c656f2245deded8fd5f5e1e6,6aca07154c111f1c8738347d7112cad6b0bf974a,6eb5744bd933dcd29ff4d79e340cf890272ef099,da95d02a50b8208a17127987dde3cdf8da455114,cbad0923db89f23febcbd6192ff4149289ff2ad9,63dc64fc2d23be98100f4c59e82278d838c78ef9,b34fc78de28be598e21118d7cb9d84d63374addc,32c1e0f9ef6f1e337fe4aa2a4907314e5a3f4a5b",21,"2156059845,47648651,2115904148"
07627bf7eb649220ffbcdf6bf233e3a4a76e8590,Asymmetric Transitivity Preserving Graph Embedding,graph embedding algorithms embed a graph into a vector space where the structure and the inherent properties of the graph are preserved the existing graph embedding methods cannot preserve the asymmetric transitivity well which is a critical property of directed graphs asymmetric transitivity depicts the correlation among directed edges that is if there is a directed path from u to v then there is likely a directed edge from u to v asymmetric transitivity can help in capturing structures of graphs and recovering from partially observed graphs to tackle this challenge we propose the idea of preserving asymmetric transitivity by approximating highorder proximity which are based on asymmetric transitivity in particular we develop a novel graph embedding algorithm highorder proximity preserved embedding hope for short which is scalable to preserve highorder proximities of large scale graphs and capable of capturing the asymmetric transitivity more specifically we first derive a general formulation that cover multiple popular highorder proximity measurements then propose a scalable embedding algorithm to approximate the highorder proximity measurements based on their general formulation moreover we provide a theoretical upper bound on the rmse root mean squared error of the approximation our empirical experiments on a synthetic dataset and three realworld datasets demonstrate that hope can approximate the highorder proximities significantly better than the stateofart algorithms and outperform the stateofart algorithms in tasks of reconstruction link prediction and vertex recommendation,2016,38,2016-08-13,"Property Graph, Property Graph Query Languages, Graph Neural Networks, Graph Embeddings, Graph Embedding Algorithms, Directed Graphs Asymmetric Transitivity, Directed Edges, Asymmetric Transitivity, Partially Observed Graphs, Approximating Highorder Proximity, Algorithm Highorder Proximity, Embedding Hope, Highorder Proximities, Large Scale Graphs, Multiple Popular Highorder Proximity Measurements, Reconstruction Link Prediction, Vertex Recommendation",Knowledge Discovery and Data Mining,"1731068,143738684,145525190,48806258,145583986","Mingdong Ou,Peng Cui,J. Pei,Ziwei Zhang,Wenwu Zhu",1731068,"00d681cfff7f0224ace607e515f4ed510e792df9,e3b9ffde49c9b4a57b09a651187a2e194cb35693,1bc34cb22131554ba18f6ba9e6ede5beb42939f1,82181d5c33590a81ab3b773c3948141eb22d89fb,b8aecf918f1c729eb2a2fa88da9eb16835daca5a,7a62457a9942e45429d4b5d9d8370210df3875ec,94deb62af3054c49e7d80bd7eb3ed5efe990fc0b,dba7c73503c4b7abad96aaa4a167fd7e701c4059,02a88547d6f6022bebc9aba6723a310cdf132f3f,de6cf3534f39748a223b9bb2b59d2e7ffcb6ae03,7ad94b0ec31d38b7915e88f743b573edb8efce5b,c48e0bd0f36c25ab83befbc7b7da369b75fd25f5,2660dcf5bd16d14862a7bbb241fa4d85ae34327f,da619a6c524f5ab800b44c8728db3cef3d3b25d9,bc9fde639ceaceafe84c0ad94a2cd7badef141d3,8cfb3412f1bd6025e14f4665c5723ed60a5d8061,3b217403302f9cb9d9685404c7646de7bc0db428,ce8a567f7578e8b6c9dc6510e2b058bd3a02019c,1e4709c0b8fe3bf759cd64dc1ede695d6e5316f0,f117c6f12d067bd66dad40996b3931c069daa2da,4e6bba65f7636a655c778a3e54cc58e148468963,69381b5efd97e7c55f51c2730caccab3d632d4d2,0fbe5e2f2e2b8e2b2e2f0013e2e07cac2e5ce926,f47def30face829e8034a292c2e3e7a9f4240d34,093e777e08d3a5474e225bbdb1a124d30434d416,b31ce19f12bbf6058f4fe849d9f3654932353f20,59a268ee97ba83c04abbe02769bd61dcd3747d25,bf69c98fca9a9f6c1cde871beddbcdc668b77771,1d174f0e3c391368d0f3384a144a6c7487f2a143,5ccd1eefd94af0a20e10a0a5e0da22aa2f481c76,91b63db746becca15090963a8990dfe2b5103799,07c4549be429a52274bc0ec083bf5598a3e5c365,dac7344737cb824634f757aede2dd46a6eed204b,d71c0365685300539109e0fd07e34c9dd9beff75,bf5a42b53d156c0811e88e60d2a49f9fd9367cae,bcad76ae5cea05bad85fd6b2b08aa30a801d9a3b,1c2de5fc71be2be3af28545e873605ead4d7d79b,db9967871249ffd77adc0c0cc16154ccc37d09ad",16,"None,1735048,2772109"
01c32c563dbf823708c706f9abe9753d54aeed28,MOTIF-Driven Contrastive Learning of Graph Representations,we propose a motifdriven contrastive framework to pretrain a graph neural network in a selfsupervised manner so that it can automatically mine motifs from large graph datasets our framework achieves stateoftheart results on various graphlevel downstream tasks with few labels like molecular property prediction,2021,90,2021-05-18,"Property Graph, Graph Mining, Graph Analytics, Graph Clustering, Large Graph Datasets, Stateoftheart Results, Molecular Property Prediction",AAAI Conference on Artificial Intelligence,"2145408511,3407296,1677386832,2109461904","Shichang Zhang,Ziniu Hu,Arjun Subramonian,Yizhou Sun",2145408511,"a0d18dddaa995b126ad373e33767b9b881d16b2f,1fe201d9ec4d072c7af233d265927388f32d3ab3,dbabab9bf5955558f73a37644f4bb626106a6d73,0ff76855604fc150ecd36bc8c3197780a8ea2b23,d71c0365685300539109e0fd07e34c9dd9beff75,9e3816be8cf4821d74e258de10ee471382936a30,391a5f286f814d852dddcab1b2b68e5c1af6c79e,1f8a23697562b001082b147779b5eaefd3513d0a,59f1df2f60280eea79d195b9c561d52a77fb24de,5d8b271c412f4be0c689bdfde93916efa0951deb,8dbab8de29b183d7589be8a568bca4b31902a54b,d154d986c3a402c207c6c0e22093f2e1a878fe71,7c70459d56214a7a3202732670f5ce726508eff6,933baeec555352784848a93284c9dd0e79477759,7ad94b0ec31d38b7915e88f743b573edb8efce5b,08257eb1faa19c29ddcc31d7d749c9bd262213c5,8e6d0ed32aaa5e3d7c598d5a2ace76eab8485801,e7c8fcbc24c73a576339e5f34f9f23f5ea732b3b,9810bcaf5ac1792e6a2738a86f85ce270d448040,18d87bff073687c025f9bd23ab2dfb20d5f72a66,cbad0923db89f23febcbd6192ff4149289ff2ad9,e259ee075998eedc0b0c91c17769bf9dffeba46f,3527f43e8156d1bf5a0998405047c98036d172f0,2660dcf5bd16d14862a7bbb241fa4d85ae34327f,adf914b04914a9b856e26c575c789ba19f9f118d,b31ce19f12bbf6058f4fe849d9f3654932353f20,9d6cbac04c498b424dfaa5ce82ac201a180c1502,3323a47e69832301f8f434119b0346fc69708915,b6b7fea1846e85ac1e3c7e3adda6e65b127d0368,873b045dea18c2092b2c11e7b9542dd93ce84d65,70f7cd54b5918aed60c3d8c3a8e4aa7e8d634c41,c7e10109fed73e523bf2a78b00e4b657004d41fc,6eb5744bd933dcd29ff4d79e340cf890272ef099,0ebd0ad7fbedde936390eeac6aed1356876cbeff,243d553f1fc5b7ee8cfb6f49629f3a0a32b2c5c5,f47def30face829e8034a292c2e3e7a9f4240d34,0a829289a16ae48837cc2905635435db98bacc76,ce8a567f7578e8b6c9dc6510e2b058bd3a02019c,bfdc1a7d5aab0f4bce4afc9723192937c24ef5ff,8640a08cdb759d52da026f6d89521e36c61b5910,bc6dbcaf4d2c76e618ae3f1043fd7276cbdf7f9b,b34fc78de28be598e21118d7cb9d84d63374addc,dac7344737cb824634f757aede2dd46a6eed204b,d427db1ba2cc92b36d16a5e5114f1027c90fff68,cc1e82125f7f8636b25ccdcdb63e8f812add7f87,db9967871249ffd77adc0c0cc16154ccc37d09ad,4d1fdd81f033cd58f3723bfc61e7d12079647a7a,fe44200fed05f9a7c656f2245deded8fd5f5e1e6,7b663c42dd72e2585eed4bf7fc41739e07ce9ff3,e8b7a9be9f2d0578a95319ed5841978e10429967,1f9058eb0b639d0dffae192b3ffd5d80adabf0e9,3dfa820702b6181c9964931f0a4d47fd298bf429,b5aea8c6ebaab339b4e190decab80ab607815e8b,659d8b24e53e8adfbcb1f16b26ada2cb8afa2c85,d63b884d5ebc739f6e1bdf861fa9276260781404,be88a24e9b6e26f10d4d84183c8f05ba33eb60c0,5bc511aa30f72720260d792e57537379fb04c395,752604994a7ca548ff2954114fc61a501d857b1c,57dcff5c3c15f6c5e5935ef7164c8f467a53848b,093e777e08d3a5474e225bbdb1a124d30434d416,689c7a86d973895a14feb984b8faa3d5581038ef,521e5c337be51b8f8fdb858580bb46a0545ab1f9,80dd97954ddf3edd22d4cb21f0ac31b7ffed6bbf,ba9b6f805feb62c978d384211f910790643a023e,4e6bba65f7636a655c778a3e54cc58e148468963,1e4709c0b8fe3bf759cd64dc1ede695d6e5316f0,73d4accea441aae2373828a8dc2175aa2759c38f,1c2de5fc71be2be3af28545e873605ead4d7d79b,1d174f0e3c391368d0f3384a144a6c7487f2a143,ccca203382e5dd198c089a0f1d7af7bef0f694e9,7e631773b14d7203eb0d85742b2a850f51eb1616,2742192c8d7248be8423e0333a9ab1c62c98bbbd,91d6e8ba5dd90b02fe3bd870b19da13a6167af53,6998e4ae3f1e037128bc57a56dd5d7707098e6bf,00d681cfff7f0224ace607e515f4ed510e792df9,4b06c7e29280b1c6bc05c9df39023b48fef02c93,0a537eaf4444f0bd59f62a550430edab9d0a820d,48fc9c42522184c652742255fdf31f7b9ed7ebae,42fe18be6e9ff2c11e5b2347c93e131c9abc7a51,a5400a6f415d65aac1312edd2ca6b7361c241f85,b1706b4463701169d339c9c791cae0d4ec367b50,15748c0437c3be2e464dfb6aa42d2ff5dbd5d7f7,2d95c27d4ed8cfb8379164888cd79c6b239250b4,e3b9ffde49c9b4a57b09a651187a2e194cb35693,dba7c73503c4b7abad96aaa4a167fd7e701c4059,aca6d5f3866372a4506cf15773ae298f18c3f453,6570ee5bd1656fddbdb030410a9d996739586067,3789eb72c32ecf5e33442570358dd786dd67c8a2,6351590cf37eef826b89383fd8ccf8f1ab276559,ae365c85a23f422300b89ef646bf6b04f2edb94e",21,"3223911,2156641189,2145903238"
